Canonical_ID,Original_Name,Full_Name,Smiley_ID,Smiley_Name,URAP_ID,URAP_Name,Gender,Chapter,Page,Saga
1886,"Guðríðr Þorkelsdóttir, kona Þorgeirs goða Þorkelssonar, ",Guðríðr Þorkelsdóttir,,,,,,,,
1887,"Guðríðr Þorsteinsdóttir Hallssonar, kona Halls Þórarinssonar í Haukadal eða ónefnds sonar Halls, ekki kona Kolbeins Flosasonar, ",Guðríðr Þorsteinsdóttir Hallssonar,,,,,,,,
1888,"Guðríðr Þorsteinsdóttir surts, ",Guðríðr Þorsteinsdóttir surts,298,Gudrid Thorsteinsdottir (wife of Thorkel Scarf),:447,Gudrid,:0,:10,:285,:Laxdoela
1889,"Guðríðr, kona Ásbjarnar at Jarðbrú, ",Guðríðr,,,,,,,,
1890,"Guðríðr, ókunn kona á Vínlandi, ",Guðríðr,,,,,,,,
1891,"Guðröðr Bjarnarson, Haraldssonar hárfagra, ",Guðröðr Bjarnarson,,,,,,,,
1892,"Guðröðr Eiríksson blóðöxar, konungr, ",Guðröðr Eiríksson blóðöxar,,,,,,,,
1893,"Guðröðr Hálfdanarson hvítbeins, ",Guðröðr Hálfdanarson hvítbeins,,,,,,,,
1894,"Guðröðr Hálfdanarson ljómi, veiðikonungr, ",Guðröðr Hálfdanarson ljómi,299,Gudrod Halfdanarson the Hunting King,:3,Gudrod the Hunting King,:1,:1,:438,:Hrafnkel
1895,"Guðröðr Haraldsson, konungr á Mön, ",Guðröðr Haraldsson,,,,,,,,
1896,"Guðrún (Brandsdóttir ór Skógum ok) dóttir Þórunnar Jósteinsdóttur, kona Gríms Loðmundarsonar, ",Guðrún (Brandsdóttir ór Skógum ok) dóttir Þórunnar Jósteinsdóttur,,,,,,,,
1897,"Guðrún Ámundadóttir, kona Bótólfs Þorsteinssonar, ",Guðrún Ámundadóttir,,,,,,,,
1898,"Guðrún Ásólfsdóttir, kona Þorfinn Geirleifssonar, ",Guðrún Ásólfsdóttir,,,,,,,,
1899,"Guðrún Bárðardóttir Snæfellsáss, ",Guðrún Bárðardóttir Snæfellsáss,,,,,,,,
1900,"Guðrún Bjarnadóttir (Goðrún), kona Einars Bergþórssonar, ",Guðrún Bjarnadóttir (Goðrún),,,,,,,,
1901,"Guðrún Bjarnadóttir, Bjarnasonar, kona Þorvarðs ins auðga Ásgrímssonar, ok síðar Þórðar Sturlusonar, ",Guðrún Bjarnadóttir,,,,,,,,
1902,"Guðrún Bjarnardóttir, fyrri kona Barða Guðmundarsonar, ",Guðrún Bjarnardóttir,,,,,,,,
1903,"Guðrún Egilsdóttir, náttsól, kona Þorgríms Austmanns, ",Guðrún Egilsdóttir,,,,,,,,
1904,"Guðrún Gjúkadóttir, ",Guðrún Gjúkadóttir,315,Gunnhild (wife of Vestein Vesteinsson),:46,Gunnhild,:0,:4,:504,:Gisla
1905,"Guðrún Glúmsdóttir, kona Jóns at Hvassafelli, ",Guðrún Glúmsdóttir,,,,,,,,
1906,"Guðrún Guðbrandsdóttir, í Dölum, ",Guðrún Guðbrandsdóttir,,,,,,,,
1907,"Guðrún Guðmundardóttir, kona Guðbrands á Guðbrandsstöðum, ",Guðrún Guðmundardóttir,303,Gudrun Gudmundardottir,:510,Gudrun,:0,:31,:326,:Laxdoela
1908,"Guðrún Halldórsdóttir, kona Kjartans Ásgeirssonar í Vatnsfirði, ",Guðrún Halldórsdóttir,,,,,,,,
1909,"Guðrún Járnskeggjadóttir ok Jórunnar Hjaltadóttur, kona Magnúss Þorsteinssonar, Síðu-Hallssonar, ",Guðrún Járnskeggjadóttir ok Jórunnar Hjaltadóttur,,,,,,,,
1910,"Guðrún Ketilsdóttir Fjörleifarsonar, kona Hrólfs yngra Ingjaldssonar, í Gnúpfelli, ",Guðrún Ketilsdóttir Fjörleifarsonar,,,,,,,,
1911,"Guðrún Klyppsdóttir hersis, kona Einars Þveræings, ",Guðrún Klyppsdóttir hersis,,,,,,,,
1912,"Guðrún knappekkja, ",Guðrún knappekkja,,,,,,,,
1913,"Guðrún Kolbeinsdóttir, frá Völlum, Flosasonar, kona Sæmundar ins fróða Sigfússonar í Odda (Þórunn), ",Guðrún Kolbeinsdóttir,,,,,,,,
1914,"Guðrún Kolbeinsdóttir, kona Skeggja Brandssonar, í Skógum, ",Guðrún Kolbeinsdóttir,,,,,,,,
1915,"Guðrún Ljótsdóttir, kona Ara Þorgilssonar at Reykjahólum, ",Guðrún Ljótsdóttir,,,,,,,,
1916,"Guðrún Loðinsdóttir, kona Atla Ótryggssonar, ",Guðrún Loðinsdóttir,,,,,,,,
1917,"Guðrún Óspaksdóttir, kona Þórarins Brandssonar, ",Guðrún Óspaksdóttir,304,Gudrun Ospaksdottir,:675,Gudrun,:1,:78,:420,:Laxdoela
1918,"Guðrún Ósvífrsdóttir, kona Þorvalds Halldórssonar, svo Þórðár Ingunnarsonar, þá Bolla Þorleikssonar ok loks Þorkels Eyjólfssonar, ",Guðrún Ósvífrsdóttir,305,Gudrun Osvifsdottir,:540,Gudrun,:0,:32,:327,:Laxdoela
1919,"Guðrún Sigmundardóttir, kona Koðráns Ormssonar, ",Guðrún Sigmundardóttir,306,Gudrun Sigmundardottir,:663,Gudrun Sigmundardottir,:1,:78,:420,:Laxdoela
1920,"Guðrún Snorradóttir goða, kona Kolfinns af Sólheimum, ",Guðrún Snorradóttir goða,,,,,,,,
1921,"Guðrún Snorradóttir Halldórsson-ar, kona Styrmis Hreinssonar, á Gilsbakka, ",Guðrún Snorradóttir Halldórsson-ar,,,,,,,,
1922,"Guðrún Steinsdóttir (réttara Þorsteinsdóttir), kona Þorsteins á Hofi, ",Guðrún Steinsdóttir (réttara Þorsteinsdóttir),,,,,,,,
1923,"Guðrún Þórarinsdóttir sælings, kona Skegg-Brodda Bjarnasonar, ",Guðrún Þórarinsdóttir sælings,,,,,,,,
1924,"Guðrún Þórðardóttir, Surtssonar, ",Guðrún Þórðardóttir,,,,,,,,
1925,"Guðrún Þorgilsdóttir, frá Hofi, ",Guðrún Þorgilsdóttir,,,,,,,,
1926,"Guðrún Þórisdóttir, kona Flosa Kolbeinssonar (ekki Flosa Valla-Brandssonar), ",Guðrún Þórisdóttir,,,,,,,,
1927,"Guðrún Þorkelsdóttir háks, kona Ótryggs, ",Guðrún Þorkelsdóttir háks,,,,,,,,
1928,"Guðrún Þorkelsdóttir, kona Skeggja Eiðssonar, ",Guðrún Þorkelsdóttir,,,,,,,,
1929,"Guðrún Þorkelsdóttir, kona Þorbjarnar þynu Hrómundarsonar, ",Guðrún Þorkelsdóttir,,,,,,,,
1930,"Guðrún Þorsteinsdóttir ok frú Ingigerðar, kona Kolbeins jarls Auðkýlings Bjarnasonar, ",Guðrún Þorsteinsdóttir ok frú Ingigerðar,,,,,,,,
1931,"Guðrún Þorsteinsdóttir rangláts, kona Jörundar Gunnarssonar, á Keldum, ",Guðrún Þorsteinsdóttir rangláts,,,,,,,,
1932,"Guðrún Þorsteinsdóttir svarfaðar (Þórarna), kona Hafþórs víkings, ",Guðrún Þorsteinsdóttir svarfaðar (Þórarna),,,,,,,,
1933,"Guðrún, frá Bægisá, kona Þorsteins verkstjóra, ",Guðrún,,,,,,,,
1934,"Guðrún, kona Heðins at Heðinshöfða, ",Guðrún,,,,,,,,
1935,"Guðrún, kona Kraka at Krakalæk, ",Guðrún,,,,,,,,
1936,"Guðrún, kona Sighvats á Melum, ",Guðrún,,,,,,,,
1937,"Guðrún, kona Þórðar í Marbæli, ",Guðrún,,,,,,,,
1938,"Guðrún, kona Þorgils örrabeinsstjúps ok síðar Þorsteins hvíta, ",Guðrún,,,,,,,,
1939,"Guðrún, kona Þórhalls Grímssonar, ",Guðrún,,,,,,,,
1940,"Guðrún, systir Kols ok Starkaðar, ",Guðrún,,,,,,,,
1941,"Guðþormr, ",Guðþormr,,,,,,,,
1942,"Gufa, ",Gufa,,,,,,,,
1943,"Gufi (Gufa) Ketilsson gufu, án efa skakkt fyrir Ketill gufa, ",Gufi (Gufa) Ketilsson gufu,,,,,,,,
1944,"Gull-Haraldr, ",Gull-Haraldr,,,,,,,,
1945,"Gull-Þórir Oddsson, at Þórisstöðum, ",Gull-Þórir Oddsson,,,,,,,,
1946,"Gunnarr at Brandastöðum, frændi Njarðvíkinga, ",Gunnarr at Brandastöðum,,,,,,,,
1947,"Gunnarr Baugsson, í Gunnarsholti, ",Gunnarr Baugsson,,,,,,,,
1948,"Gunnarr Egilsson, Skalla-Grímssonar, ",Gunnarr Egilsson,309,Gunnar Egilsson (Skallagrimsson),:226,Gunnar Egilsson,:1,:-1,:-1,:Egil
1949,"Gunnarr Hámundarson inn eldri, ",Gunnarr Hámundarson inn eldri,,,,,,,,
1950,"Gunnarr Hámundarson, á Hlíðarenda, ",Gunnarr Hámundarson,,,,,,,,
1951,"Gunnarr helmingr, ",Gunnarr helmingr,,,,,,,,
1952,"Gunnarr Hlífarson, (líkl. Torf-Einarsdóttur jarls, ok Rauðsson Kjallakssonar, Kjarvalssonar Írakonungs), í Örnólfsdal, ",Gunnarr Hlífarson,311,Gunnar Hlifarson,:285:417,Gunnar Hlifarson,:1:1,:-1:7,:-1:282,:Egil:Laxdoela
1953,"Gunnarr inn spaki Þorgrímsson, lögsögumaðr, ",Gunnarr inn spaki Þorgrímsson,,,,,,,,
1954,"Gunnarr kelda, ór Skörðum, ",Gunnarr kelda,,,,,,,,
1955,"Gunnarr Lambason, ",Gunnarr Lambason,,,,,,,,
1956,"Gunnarr Rauðsson, ",Gunnarr Rauðsson,,,,,,,,
1957,"Gunnarr Sigmundarson, ",Gunnarr Sigmundarson,,,,,,,,
1958,"Gunnarr Skeggjason, ",Gunnarr Skeggjason,,,,,,,,
1959,"Gunnarr Úlfljótsson, í Djúpadal í Eyjafirði, ",Gunnarr Úlfljótsson,,,,,,,,
1960,"Gunnarr Valbrandsson, ",Gunnarr Valbrandsson,,,,,,,,
1961,"Gunnarr Þiðrandabani, ",Gunnarr Þiðrandabani,312,Gunnar Thidrandabani,:653,Gunnar,:0,:67,:400,:Laxdoela
1962,"Gunnarr Þorbjarnarson Keldugnúpsfífl, ",Gunnarr Þorbjarnarson Keldugnúpsfífl,,,,,,,,
1963,"Gunnarr Þórisson, at Skarði, ",Gunnarr Þórisson,,,,,,,,
1964,"Gunnarr Þorsteinsson tjaldstæðings, ",Gunnarr Þorsteinsson tjaldstæðings,,,,,,,,
1965,"Gunnarr Þorsteinsson, í Bæ, ",Gunnarr Þorsteinsson,,,,,,,,
1966,"Gunnarr, á Gunnarsstöðum (Vöflu-Gunnarr), ",Gunnarr,,,,,,,,
1967,"Gunnarr, bóndi í Skál, ",Gunnarr,,,,,,,,
1968,"Gunnarr, bróðir Þorvalds kroppinskeggja, ",Gunnarr,,,,,,,,
1969,"Gunnarr, garðsbóndi í Túnsbergi, ",Gunnarr,,,,,,,,
1970,"Gunnarr, mágr Þorgils Víkrskalla, ",Gunnarr,,,,,,,,
1971,"Gunnarr, systursonr Hróars Tungugoða, ",Gunnarr,,,,,,,,
1972,"Gunnarr, víkingr, ",Gunnarr,,,,,,,,
1973,"Gunnarr, víkverskr stýrimaðr, ",Gunnarr,,,,,,,,
1974,"Gunnbjörn Brynjólfsson ins gamla, ",Gunnbjörn Brynjólfsson ins gamla,,,,,,,,
1975,"Gunnbjörn Erpsson, ",Gunnbjörn Erpsson,,,,,,,,
1976,"Gunnbjörn Finnbogason eldri, ",Gunnbjörn Finnbogason eldri,,,,,,,,
1977,"Gunnbjörn Finnbogason yngri, ",Gunnbjörn Finnbogason yngri,,,,,,,,
1978,"Gunnbjörn gandr, ",Gunnbjörn gandr,,,,,,,,
1979,"Gunnbjörn Ingjaldsson, faðir Ásbjarnar dettiáss, ",Gunnbjörn Ingjaldsson,,,,,,,,
1980,"Gunnbjörn Úlfsson kráku, ",Gunnbjörn Úlfsson kráku,,,,,,,,
1981,"Gunnbjörn Úlfsson, ór Úlfsdölum, ",Gunnbjörn Úlfsson,,,,,,,,
1982,"Gunnfríðr Þórólfsdóttir, kona Þorbeinis á Þorbeinisstöðum, ",Gunnfríðr Þórólfsdóttir,,,,,,,,
1983,"Gunnhildí Ozurardóttir konungamóðir, drottning Eiríks blóðöxar, ",Gunnhildí Ozurardóttir konungamóðir,318,Gunnhild Ozurardottir (queen. wife of Eirik Blood-axe),:141:468,Gunnhild Ozurardottir,:0:0,:-1:19,:-1:300,:Egil:Laxdoela
1984,"Gunnhildr (Hildr), kona Vésteins Vésteinssonar, ",Gunnhildr (Hildr),,,,,,,,
1985,"Gunnhildr Ásláksdóttir, kona Breiðs Sigmundarsonar ok síðar Halldórs Þorleifssonar á Hólmlátri, ",Gunnhildr Ásláksdóttir,,,,,,,,
1986,"Gunnhildr Bjarnardóttir hölds, ",Gunnhildr Bjarnardóttir hölds,316,Gunnhild Bjarnardottir,:145,Gunnhild Bjornsdottir,:0,:-1,:-1,:Egil
1987,"Gunnhildr Bjartmarsdóttir, ",Gunnhildr Bjartmarsdóttir,,,,,,,,
1988,"Gunnhildr Eiríksdóttir, kona Véfröðar Ævarssonar, ",Gunnhildr Eiríksdóttir,,,,,,,,
1989,"Gunnhildr Hálfdan ár dóttir, kona Finns ins skjálga, ",Gunnhildr Hálfdan ár dóttir,317,Gunnhild Halfdanardottir (wife of Finn the Squinter),:64,Gunnhild Finn's wife,:0,:-1,:-1,:Egil
1990,"Gunnhildr ísröðardóttir, kona Odda Ásólfssonar í Höfða, ",Gunnhildr ísröðardóttir,,,,,,,,
1991,"Gunnhildr Ormsdóttir (eða Yngvildr), kona Hermundar Ingasonar, ",Gunnhildr Ormsdóttir (eða Yngvildr),,,,,,,,
1992,"Gunnhildr Símonardóttir, kona Þorgils, ",Gunnhildr Símonardóttir,,,,,,,,
1993,"Gunnhildr Þorkelsdóttir, kona Kala Kvistssonar, ",Gunnhildr Þorkelsdóttir,,,,,,,,
1994,"Gunnhildr Þorsteinsdóttir hólmunns, Skaftasonar, ",Gunnhildr Þorsteinsdóttir hólmunns,,,,,,,,
1995,"Gunnhildr, kona Loðins í Fagratungu, ",Gunnhildr,,,,,,,,
1996,"Gunnhildr, móðir Sigurðar Torfafóstra, ",Gunnhildr,,,,,,,,
1997,"Gunnlaug Ófeigsdóttir, kona Skíða, ",Gunnlaug Ófeigsdóttir,,,,,,,,
1998,"Gunnlaugr Hjörleifsson, ",Gunnlaugr Hjörleifsson,,,,,,,,
1999,"Gunnlaugr Hrólfsson (Hjörleifsson), ",Gunnlaugr Hrólfsson (Hjörleifsson),,,,,,,,
2000,"Gunnlaugr Ketilsson ofláti, ",Gunnlaugr Ketilsson ofláti,,,,,,,,
2001,"Gunnlaugr Leifsson, munkr, ",Gunnlaugr Leifsson,,,,,,,,
2002,"Gunnlaugr ormstunga Hrómundarson, á Gunnlaugsstöðum, ",Gunnlaugr ormstunga Hrómundarson,320,Gunnlaug Hromundarson,:200,Gunnlaug Hromundarson,:0,:-1,:-1,:Egil
2003,"Gunnlaugr ormstunga Illugason, skáld, ",Gunnlaugr ormstunga Illugason,321,Gunnlaug Illugason Serpent-tongue (poet),:302:383:72,Gunnlaug Illugason Serpent Tongue,:1:1:1,:-1:6:-1,:-1:280:-1,:Egil:Laxdoela:Eyrbyggja
2004,"Gunnlaugr Steinþórsson, á Eyri, ",Gunnlaugr Steinþórsson,,,,,,,,
2005,"Gunnlaugr Þorbjarnarson, frá Fróðá, ",Gunnlaugr Þorbjarnarson,,,,,,,,
2006,"Gunnlaugr Þorfinnsson, ór Straumfirði, ",Gunnlaugr Þorfinnsson,,,,,,,,
2007,"Gunnlaugr Þormóðarson inn auðgi, í Straumfirði, ",Gunnlaugr Þormóðarson inn auðgi,,,,,,,,
2008,"Gunnólfr Þorbjarnarson inn gamli, landnm. at Gunnólfsá, (Eyjólfr), ",Gunnólfr Þorbjarnarson inn gamli,,,,,,,,
2009,"Gunnólfr Þórisson kroppa, landnm. í Fagravík á Langanesi, ",Gunnólfr Þórisson kroppa,,,,,,,,
2010,"Gunnólfr, landnm. í Hvammi í Skagafirði, ",Gunnólfr,,,,,,,,
2011,"Gunnr (Guðr), valkyrja, ",Gunnr (Guðr),,,,,,,,
2012,"Gunnsteinn Bölverksson berserkjabani, ",Gunnsteinn Bölverksson berserkjabani,,,,,,,,
2013,"Gunnsteinn Eysteinsson, í Lóni, ",Gunnsteinn Eysteinsson,,,,,,,,
2014,"Gunnsteinn Gunnbjarnarson, landnm. í Laugardal vestra, ",Gunnsteinn Gunnbjarnarson,,,,,,,,
2015,"Gunnsteinn Kóreksson, ",Gunnsteinn Kóreksson,,,,,,,,
2016,"Gunnsteinn Þorbjarnarson (Kóreksson), ",Gunnsteinn Þorbjarnarson (Kóreksson),,,,,,,,
2017,"Gunnsteinn Þórðarson, at Ljósavatni, ",Gunnsteinn Þórðarson,,,,,,,,
2018,"Gunnsteinn Þórisson línu, goðorðsmaðr á Desjarmýri í Borgarfirði eystra, ",Gunnsteinn Þórisson línu,,,,,,,,
2019,"Gunnsteinn, á Gunnsteinsstöðum, ",Gunnsteinn,,,,,,,,
2020,"Gunnsteinn, bóndi at Þverá, ",Gunnsteinn,,,,,,,,
2021,"Gunnsteinn, fylgdarmaðr Illuga Tagldarbana, ",Gunnsteinn,,,,,,,,
2022,"Gunnvaldr Rauða-Bjarnarson, ",Gunnvaldr Rauða-Bjarnarson,,,,,,,,
2023,"Gunnvarðr Þorfiðarson, ",Gunnvarðr Þorfiðarson,,,,,,,,
2024,"Gunnvör Bjarnadóttir, kona Þórhalls eldra Asgrímssonar, ",Gunnvör Bjarnadóttir,,,,,,,,
2025,"Gunnvör Guttormsdóttir, Ragasonar, kona Þorleifs [Þjóstólfssonar], ",Gunnvör Guttormsdóttir,,,,,,,,
2026,"Gunnvör Hróðgeirsdóttir, kona Kolgríms ins gamla Hrólfssonar, ",Gunnvör Hróðgeirsdóttir,,,,,,,,
2027,"Gustr, sauðamaðr Þorbjarnar í Tungu, ",Gustr,,,,,,,,
2028,"Guttormr Eiríksson blóðöxar, konungr, ",Guttormr Eiríksson blóðöxar,,,,,,,,
2029,"Guttormr erkibyskup, í Niðarósi, ",Guttormr erkibyskup,,,,,,,,
2030,"Guttormr Ragason (Goðormr, Guðþormr), ",Guttormr Ragason (Goðormr Guðþormr),,,,,,,,
2031,"Guttormr Rögnvaldsson, ",Guttormr Rögnvaldsson,,,,,,,,
2032,"Guttormr Sigurðarson hjartar Guðþormr), ",Guttormr Sigurðarson hjartar Guðþormr),323,Guttorm Sigurdarson,:104,Guttorm Sigudarson,:1,:-1,:-1,:Egil
2033,"Gyða Möttulsdóttir, kona Sigurðar Helgasonar, ",Gyða Möttulsdóttir,,,,,,,,
2034,"Gyða Snjólfsdóttir, kona Eiríks skálds, ",Gyða Snjólfsdóttir,,,,,,,,
2035,"Gyða Sölmundardóttir, ",Gyða Sölmundardóttir,,,,,,,,
2036,"Gyða Þórisdóttir, húsfreyja á Blindheimi, ",Gyða Þórisdóttir,325,Gyda Thorisdottir (sister of Arinbjorn),:222,Gyda Thorisdottir,:0,:-1,:-1,:Egil
2037,"Gyða, ekkja í Vestr-Víkinni, ",Gyða,,,,,,,,
2038,"Gyða, kona Ingjalds tryggva í Hvini, ",Gyða,,,,,,,,
2039,"Gyðlaug, ",Gyðlaug,,,,,,,,
2040,"Gyðríðr Þorsteinsdóttir, ",Gyðríðr Þorsteinsdóttir,,,,,,,,
2041,"Gylfi, sækonungr, ",Gylfi,,,,,,,,
2042,"Gyllingar-Kali, frændi Einars þambarskelfis, ",Gyllingar-Kali,,,,,,,,
2043,"Gyrðr inn halti, víkingr, ",Gyrðr inn halti,,,,,,,,
2044,"Gyrðr Sigvaldason jarl, ",Gyrðr Sigvaldason jarl,,,,,,,,
2045,"Gyrðr, móðurfaðir Skjálgs á Jaðri, ",Gyrðr,,,,,,,,
2046,"Gýríðr Einarsdóttir, bóndadóttir, ",Gýríðr Einarsdóttir,,,,,,,,
2047,"Há-Snorri, ",Há-Snorri,,,,,,,,
2048,"Háarr (Hávarr, Hárr), heiti Óðins, ",Háarr (Hávarr Hárr),,,,,,,,
2049,"Haddgrímr, víkingr, ",Haddgrímr,,,,,,,,
2050,"Haddr Þorgeirsson þyrnifótar, ",Haddr Þorgeirsson þyrnifótar,326,Hadd Thorgeirsson,:147,Hadd Thorgeirsson,:1,:-1,:-1,:Egil
2051,"Hækill, faðir Snorra á Hvítstöðum, ",Hækill,,,,,,,,
2052,"Hækils-Snorri, ",Hækils-Snorri,,,,,,,,
2053,"Hækingr, í Hækingsdal, ",Hækingr,,,,,,,,
2054,"Hængr Þorkelsson, ",Hængr Þorkelsson,,,,,,,,
2055,"Hængr, ",Hængr,,,,,,,,
2056,"Hænsa-Þórir (Hæsna-), ",Hænsa-Þórir (Hæsna-),,,,,,,,
2057,"Hæringr Þorgrímsson örrabeins, ",Hæringr Þorgrímsson örrabeins,,,,,,,,
2058,"Hæringr, at Hæringsstöðum, ",Hæringr,,,,,,,,
2059,"Hæringr, Austmaðr, ",Hæringr,,,,,,,,
2060,"Hafgrímr, landnm. í Hafgrímsfirði á Grænlandi, ",Hafgrímr,,,,,,,,
2061,"Hafijotr Þorbergsson, ",Hafijotr Þorbergsson,,,,,,,,
2062,"Hafli, jötunn, ",Hafli,,,,,,,,
2063,"Hafliði Hrólfsson inn örvi, á Möðruvöllum í Eyjafirði, ",Hafliði Hrólfsson inn örvi,,,,,,,,
2064,"Hafliði Másson goðorðsmaðr, á Breiðabólstað í Vesturhópi, ",Hafliði Másson goðorðsmaðr,,,,,,,,
2065,"Hafliði Þorgestsson, ",Hafliði Þorgestsson,,,,,,,,
2066,"Hafliði, at Reyðarfelli, ",Hafliði,,,,,,,,
2067,"Hafnar-Ormr, ",Hafnar-Ormr,,,,,,,,
2068,"Hafr Hámundarson, frá Hlíðarenda, ",Hafr Hámundarson,,,,,,,,
2069,"Hafr inn spaki, ",Hafr inn spaki,,,,,,,,
2070,"Hafr Þórarinsson, at Knappstöðum, ",Hafr Þórarinsson,,,,,,,,
2071,"Hafr Þórðarson knapps, ",Hafr Þórðarson knapps,,,,,,,,
2072,"Hafr Þorkelsson inn auðgi, í Goðdölum, ",Hafr Þorkelsson inn auðgi,,,,,,,,
2073,"Hafr-Björn Molda-Gnúpsson, í Grindavík, ",Hafr-Björn Molda-Gnúpsson,,,,,,,,
2074,"Hafr-Björn Styrkársson, í Nesi, ",Hafr-Björn Styrkársson,,,,,,,,
2075,"Hafr, á Hafrsstöðum í Knappadal, ",Hafr,,,,,,,,
2076,"Hafr, í Hvammi, ",Hafr,,,,,,,,
2077,"Hafþóra Þorbergsdóttir kornamúla, kona Eiðs Skeggjasonar í Ási, ",Hafþóra Þorbergsdóttir kornamúla,,,,,,,,
2078,"Hafþórr Þorgeirsson, í Hítardal, ",Hafþórr Þorgeirsson,,,,,,,,
2079,"Hafþórr, frændi Özurar á Grund, ",Hafþórr,,,,,,,,
2080,"Hafþórr, víkingr (Snækollr), ",Hafþórr,,,,,,,,
2081,"Hagbarðr, fornhetja, ",Hagbarðr,,,,,,,,
2082,"Haki Járnskjaldarson, ",Haki Járnskjaldarson,,,,,,,,
2083,"Haki, sækonungr, ",Haki,,,,,,,,
2084,"Haki, skozkr maðr, ",Haki,,,,,,,,
2085,"Haki, þræll Ketilbjarnar gamla, ",Haki,,,,,,,,
2086,"Hákon Aðalsteinsfóstri inn góði Haraldsson hárfagra, Noregs-konungr, ",Hákon Aðalsteinsfóstri inn góði Haraldsson hárfagra,329,Hakon Haraldsson the Good,:186:430,Hakon the Good,:1:1,:-1:9,:-1:284,:Egil:Laxdoela
2087,"Hákon Eiríksson jarl, ",Hákon Eiríksson jarl,,,,,,,,
2088,"Hákon Gizurarson galla, í Víðidalstungu, ",Hákon Gizurarson galla,,,,,,,,
2089,"Hákon Grjótgarðsson inn gamli, Hhðajarl, ",Hákon Grjótgarðsson inn gamli,328,Hakon (Earl of Lade),:31,Hakon of Lade Harald's Earl,:1,:-1,:-1,:Egil
2090,"Hákon Ívarsson jarl, ",Hákon Ívarsson jarl,,,,,,,,
2091,"Hákon Magnússon, fóstri Steigar-Þóris, ",Hákon Magnússon,,,,,,,,
2092,"Hákon Serksson mörstrútr, ",Hákon Serksson mörstrútr,,,,,,,,
2093,"Hákon Sigurðarson inn ríki, Hlaðajarl, ",Hákon Sigurðarson inn ríki,330,Hakon Sigurdarson the Earl/the Powerful,:502:36,Earl Hakon the Powerful,:1:1,:29:-1,:322:-1,:Laxdoela:Eyrbyggja
2094,"Hákon, á Forboða, í Þrándheimi, ",Hákon,,,,,,,,
2095,"Hákon, landnm. á Hákonarstöðum á Jökuldal, ",Hákon,,,,,,,,
2096,"Hákon, víkverskr maðr, ",Hákon,,,,,,,,
2097,"Hákr Járnskjaldarson, ",Hákr Járnskjaldarson,,,,,,,,
2098,"Háleygr Skjöldólfsson, á Stræti, ",Háleygr Skjöldólfsson,,,,,,,,
2099,"Háleygr, konungr á Hálogalandi, ",Háleygr,,,,,,,,
2100,"Hálfdan Eysteinsson inn gamli, inn mildi ok inn matarilli, Upplendingakonungr, ",Hálfdan Eysteinsson inn gamli,331,Halfdan Eysteinsson the Mild and Meal-stingy (king),:4,Halfdan the Mild and Meal-stingy,:1,:1,:438,:Hrafnkel
2101,"Hálfdan Guðröðarson svarti, Upplendingakonungr, ",Hálfdan Guðröðarson svarti,333,Halfdan Gudrodarson the Black (King of Norway) ,:22:2,Halfdan the Black Harald's father,:1:1,:-1:1,:-1:438,:Egil:Hrafnkel
2102,"Hálfdan Haraldsson inn snjalli, fornkonungr í Danmörku, ",Hálfdan Haraldsson inn snjalli,,,,,,,,
2103,"Hálfdan hvítbeinn Óláfsson, Upplendingakonungr, ",Hálfdan hvítbeinn Óláfsson,334,Halfdan Olafsson White-leg (King of Norway),:232,Halfdan White-leg,:1,:-1,:-1,:Egil
2104,"Hálfdan jarl, móðurfaðir Eyvindar skáldaspillis, ",Hálfdan jarl,,,,,,,,
2105,"Hálfdan Sigurðarson hrísa, konungr í Hringaríki, ",Hálfdan Sigurðarson hrísa,,,,,,,,
2106,"Hálfr Hjörleifsson, Hálfsrekka-konungr, ",Hálfr Hjörleifsson,,,,,,,,
2107,"Halla Bjarnadóttir, frá Hofi, ",Halla Bjarnadóttir,,,,,,,,
2108,"Halla Eyjólfsdóttir, kona Atla Tannasonar, ",Halla Eyjólfsdóttir,,,,,,,,
2109,"Halla Flosadóttir, kona Vilhjálms prests Sæmundarsonar frá Odda, ",Halla Flosadóttir,,,,,,,,
2110,"Halla Gestsdóttir, Oddleifssonar, kona Snorra Dala-Álfssonar, ",Halla Gestsdóttir,340,Halla (mother of Thorgils Holluson),:632,Halla,:1,:57,:383,:Laxdoela
2111,"Halla Heðinsdóttir, kona Herfinns Þorgilssonar, ",Halla Heðinsdóttir,,,,,,,,
2112,"Halla Jörundardóttir háls, kona Þórarins Atlasonar, ",Halla Jörundardóttir háls,,,,,,,,
2113,"Halla Jörundardóttir ok Guðrúnar, kona Bjarna prests Bjarnasonar á Völlum á Landi, ",Halla Jörundardóttir ok Guðrúnar,,,,,,,,
2114,"Halla Loftsdóttir, Þórarinssonar, ok Ragnheiðar, kona Orms (Arngrímssonar) ok síðar Steinars Þórðarsonar, ",Halla Loftsdóttir,,,,,,,,
2115,"Halla Lýtingsdóttir, fyrri kona Brodd-Helga Þorgilssonar, ",Halla Lýtingsdóttir,,,,,,,,
2116,"Halla Másdóttir, kona Geirs goða Asgeirssonar, ",Halla Másdóttir,,,,,,,,
2117,"Halla Oddsdóttir, Álasonar, ",Halla Oddsdóttir,,,,,,,,
2118,"Halla Steinadóttir, kona Þórhalls Þorlákssonar, ",Halla Steinadóttir,,,,,,,,
2119,"Halla Steinólfsdóttir, kona Þórðar Oddleifssonar, ",Halla Steinólfsdóttir,,,,,,,,
2120,"Hallaðr Rögnvaldsson jarl, í Orkneyjum, ",Hallaðr Rögnvaldsson jarl,342,Hallad Rognvaldsson,:22,Hallad Rognvaldsson,:1,:9,:203,:Vatnsdal
2121,"Hallar-Steinn, skáld, ",Hallar-Steinn,,,,,,,,
2122,"Hallbera Aradóttir, kona Odda Snærissonar, ",Hallbera Aradóttir,,,,,,,,
2123,"Hallbera Brodd-Helgadóttir, ",Hallbera Brodd-Helgadóttir,,,,,,,,
2124,"Hallbera Búadóttir, Andríðssonar, ",Hallbera Búadóttir,,,,,,,,
2125,"Hallbera Grímsdóttir (Halldóra), kona Skeggja Bjarnasonar í Gröf, ",Hallbera Grímsdóttir (Halldóra),,,,,,,,
2126,"Hallbera Hrafnsdóttir, Úlfheðinssonar, kona Hreins ábóta Styrmissonar, ",Hallbera Hrafnsdóttir,,,,,,,,
2127,"Hallbera Hróaldsdóttir, kona Starkaðar Barkarsonar, (líkl. réttara kona Starkaðar Þórðarsonar, bróður Brennu-Flosa), ",Hallbera Hróaldsdóttir,,,,,,,,
2128,"Hallbera Hrollaugsdóttir, kona Ásbjarnar Hrafnkelssonar, ",Hallbera Hrollaugsdóttir,,,,,,,,
2129,"Hallbera Önundardóttir, Þorgilssonar, ",Hallbera Önundardóttir,,,,,,,,
2130,"Hallbera Snorradóttir goða, kona Þórðar Sturlusonar, ",Hallbera Snorradóttir goða,343,Hallbera (mother of Gudmund the Powerful),:78,Hallbera,:2,:-1,:-1,:Eyrbyggja
2131,"Hallbera Snorradóttir, (rangt Halldóra), kona Markúss Þórðarsonar á Melum, ",Hallbera Snorradóttir,,,,,,,,
2132,"Hallbera Snorradóttir, kona Mág-Snorra Þórðarsonar, ",Hallbera Snorradóttir,,,,,,,,
2133,"Hallbera Úlfsdóttir ins óarga, kona Brunda-Bjálfa, ",Hallbera Úlfsdóttir ins óarga,344,Hallbera (mother of Kveldulf),:3,Hallbera Ulf's mother,:0,:-1,:-1,:Egil
2134,"Hallbera Úlfsdóttir, kona Þormóðs Lýtingssonar, ",Hallbera Úlfsdóttir,,,,,,,,
2135,"Hallbera Þorfinnsdóttir, kona Þóris hasts, ",Hallbera Þorfinnsdóttir,,,,,,,,
2136,"Hallbera Þorgilsdóttir, kona Gunnsteins Þórissonar á Einarsstöðum, ",Hallbera Þorgilsdóttir,,,,,,,,
2137,"Hallbera Þóroddsdóttir hjálms, kona Eyjólfs Einarssonar (Valgerðarsonar), ",Hallbera Þóroddsdóttir hjálms,343,Hallbera (mother of Gudmund the Powerful),:27,Hallbera mother of Gudmund the Powerful,:0,:10,:204,:Vatnsdal
2138,"Hallbera Þorsteinsdóttir ok Ingigerðar, abbadís á Reynistað, ",Hallbera Þorsteinsdóttir ok Ingigerðar,,,,,,,,
2139,"Hallbjörg Bárðardóttir, Höskuldssonar, kona Halls Víga-Styrssonar (Guðný), ",Hallbjörg Bárðardóttir,,,,,,,,
2140,"Hallbjörg Hafþórsdóttir, Þorgeirssonar, kona Þórhalls yngra Eiðssonar, ",Hallbjörg Hafþórsdóttir,,,,,,,,
2141,"Hallbjörn Egilsson, á Egilsstöðum, ",Hallbjörn Egilsson,,,,,,,,
2142,"Hallbjörn hali, skáld, ",Hallbjörn hali,,,,,,,,
2143,"Hallbjörn Hörðakappi, ",Hallbjörn Hörðakappi,,,,,,,,
2144,"Hallbjörn Hrómundarson, ",Hallbjörn Hrómundarson,,,,,,,,
2145,"Hallbjörn húfa, göngumaðr, ",Hallbjörn húfa,345,Hallbjorn (a wanderer),:93,Hallbjorn,:1,:28,:541,:Gisla
2146,"Hallbjörn inn sterki, í Eydölum, ",Hallbjörn inn sterki,,,,,,,,
2147,"Hallbjörn Kotkelsson slíkisteinsauga, ",Hallbjörn Kotkelsson slíkisteinsauga,347,Hallbjorn Kotkelsson Slickstone-eye,:563,Hallbjorn Slickstone-eye,:1,:35,:333,:Laxdoela
2148,"Hallbjörn Oddsson, frá Kiðjabergi, ",Hallbjörn Oddsson,,,,,,,,
2149,"Hallbjörn Oddsson, Þórormssonar, ",Hallbjörn Oddsson,,,,,,,,
2150,"Hallbjörn Skarfsson inn hvíti, ",Hallbjörn Skarfsson inn hvíti,,,,,,,,
2151,"Hallbjörn skefill, ór Laxárdal, ",Hallbjörn skefill,,,,,,,,
2152,"Hallbjörn Úlfsson hálftröll, í Hrafnistu, ",Hallbjörn Úlfsson hálftröll,346,Hallbjorn Half-troll (from Hrafnista),:5:43,Hallbjorn Half-troll from Hrafnista,:1:1,:-1:4,:-1:504,:Egil:Gisla
2153,"Hallbjörn, af Silfrastöðum,",Hallbjörn,,,,,,,,
2154,"Hallbrandr Þórólfsson, sænskr maðr, ",Hallbrandr Þórólfsson,,,,,,,,
2155,"Halldís Erpsdóttir, kona Álfs Eysteinssonar í Dölum, ",Halldís Erpsdóttir,349,Halldis Erpsdottir,:389,Halldis,:0,:6,:280,:Laxdoela
