Canonical_ID,Original_Name,Full_Name,Smiley_ID,Smiley_Name,URAP_ID,URAP_Name,Gender,Chapter,Page,Saga
1,"Abraham, ermskr byskup á Íslandi, ",Abraham,,,,,,,,
2,"Absalon, erkibyskup í Lundi, ",Absalon,,,,,,,,
3,"Absalon, galeiðuforingi, ",Absalon,,,,,,,,
4,"Aðal-Grímr (= Óláfr konungr helgi), ",Aðal-Grímr (= Óláfr konungr helgi),,,,,,,,
5,"Aðalbrekt, enskr maðr, ",Aðalbrekt,,,,,,,,
6,"Aðalráðr Játgeirsson, Englakonungr, ",Aðalráðr Játgeirsson,,,,,,,,
7,"Aðalsteinn inn sigrsæli Játvarðs son, Englakonungr, ",Aðalsteinn inn sigrsæli Játvarðs son,67,Athelstan the Victorious/the Faithful,:185:431,Athelstan the Victorious,:1:1,:-1:9,:-1:284,:Egil:Laxdoela
8,"Aðalsteinsfóstri, ",Aðalsteinsfóstri,,,,,,,,
9,"Aðgils, ",Aðgils,,,,,,,,
10,"Aðils (Aðgils), jarl í Bretlandi, ",Aðils (Aðgils),2,Adils (Earl in Britain),:192,Adils,:1,:-1,:-1,:Egil
11,"Aðísl (Aðils) inn ríki Óttarsson, Svíakonungr, ",Aðísl (Aðils) inn ríki Óttarsson,,,,,,,,
12,"Adrianus páfi, ",Adrianus páfi,,,,,,,,
13,"Ægileif Hrólfsdóttir, Helgasonar, kona Hróalds Höskuldssonar í Skörðum, ",Ægileif Hrólfsdóttir,,,,,,,,
14,"Ægileif Þorsteinsdóttir, kona Hlenna Ásmundarsonar, ",Ægileif Þorsteinsdóttir,,,,,,,,
15,"Ægir, sjávarguð, ",Ægir,,,,,,,,
16,"Æsa Grjótgarðsdóttir jarls (Hákonardóttir), móðir Ketilbjarnar gamla, ",Æsa Grjótgarðsdóttir jarls (Hákonardóttir),,,,,,,,
17,"Æsa Hákonardóttir jarls, ",Æsa Hákonardóttir jarls,,,,,,,,
18,"Æsa Hrólfsdóttir rauðskeggs (Ása), kona Þorsteins Sigmundarsonar, ",Æsa Hrólfsdóttir rauðskeggs (Ása),,,,,,,,
19,"Æsa in ljósa Eysteinsdóttir af Valdresi, kona Hjörleifs ins kvensama Hjörssonar, ",Æsa in ljósa Eysteinsdóttir af Valdresi,,,,,,,,
20,"Æsa in örðiga Hlöðvésdóttir, ",Æsa in örðiga Hlöðvésdóttir,,,,,,,,
21,"Æsa Kjallaksdóttir, í Svíney, ",Æsa Kjallaksdóttir,,,,,,,,
22,"Æsa Ljótólfsdóttir goða, kona Þórðar knapps Bjarnarsonar, ",Æsa Ljótólfsdóttir goða,,,,,,,,
23,"Æsa Oddleifsdóttir, kona Þorgils Gripssonar, ",Æsa Oddleifsdóttir,,,,,,,,
24,"Æsa Ófeigsdóttir grettis, Önundarsonar, ",Æsa Ófeigsdóttir grettis,,,,,,,,
25,"Æsa Vaðadóttir, á Skáldsstöðum í Berufirði, ",Æsa Vaðadóttir,,,,,,,,
26,"Æsa, kona Þórðar á Núpi, ",Æsa,,,,,,,,
27,"Ævarr Ketilsson inn gamli, landnm. í Ævarsskarði, ",Ævarr Ketilsson inn gamli,,,,,,,,
28,"Ævarr Vémundar orðlokars, ",Ævarr Vémundar orðlokars,,,,,,,,
29,"Ævarr Þorgeirsson inn gamli, landnm. á Arnhallsstöðum, ",Ævarr Þorgeirsson inn gamli,,,,,,,,
30,"Agði, sem Agðanes er við kennt, ",Agði,,,,,,,,
31,"Agnarr Ragnarsson loðbrókar, ",Agnarr Ragnarsson loðbrókar,,,,,,,,
32,"Agnarr Reginmóðsson, berserkr, ",Agnarr Reginmóðsson,,,,,,,,
33,"Agnarr, bóndi á Grænmörk, ",Agnarr,,,,,,,,
34,"Agni Alreksson, Svíakonungr, ",Agni Alreksson,,,,,,,,
35,"Áki Atlason, Ótryggssonar, ",Áki Atlason,,,,,,,,
36,"Áki inn auðgi, danskr maðr, ",Áki inn auðgi,4,Aki the Wealthy,:173,Aki,:1,:-1,:-1,:Egil
37,"Áki, ármaðr Sveinskonungs Úlfssonar, ",Áki,,,,,,,,
38,"Akkerisfrakki, gervinafn Óláfs Tryggvasonar, ",Akkerisfrakki,,,,,,,,
39,"Akra-Þórir, ",Akra-Þórir,,,,,,,,
40,"Akraskeggr, ",Akraskeggr,,,,,,,,
41,"Albertus byskup í Brimum, ",Albertus byskup í Brimum,,,,,,,,
42,"Albertus, erkibyskup í Brimum, ",Albertus,,,,,,,,
43,"Aldís Ljótsdóttir (Hólmgöngu-Ljóts),  ",Aldís Ljótsdóttir (Hólmgöngu-Ljóts),5,Aldis Ljotsdottir (the Dueller),:613,Aldis,:0,:50,:374,:Laxdoela
44,"Aldís Ófeigsdóttir grettis, Einarssonar, kona Áskels Ormssonar í Húsagarði, móðir Valla-Brands, ",Aldís Ófeigsdóttir grettis,,,,,,,,
45,"Aldís Ófeigsdóttir grettis, Önundarsonar tréfóts, (Ásdís), kona Bárðar Jökulssonar, rangl. talin móðir Valla-Brands, ",Aldís Ófeigsdóttir grettis,,,,,,,,
46,"Aldís Óláfsdóttir, ",Aldís Óláfsdóttir,,,,,,,,
47,"Áleifr, ",Áleifr,,,,,,,,
48,"Alexander Leósson, Miklagarðskeisari, ",Alexander Leósson,,,,,,,,
49,"Alexíus, Grikkjakonungr, ",Alexíus,,,,,,,,
50,"Alfarinn Válason, landnm. á Snæfellsnesi, ",Alfarinn Válason,,,,,,,,
51,"Álfdís Gamladóttir, ",Álfdís Gamladóttir,,,,,,,,
52,"Álfdís Koðránsdóttir, kona Brúna í Gnúpufelli, ",Álfdís Koðránsdóttir,,,,,,,,
53,"Álfdís Konálsdóttir, kona Óláfs feilans, ",Álfdís Konálsdóttir,10,Alfdis (wife of Olaf Thorsteinsson Feilan),:404,Alfdis,:0,:7,:281,:Laxdoela
54,"Álfdís, kona Refs at Haugi, ",Álfdís,9,Alfdis (at Haug. wife of Ref),:92,Alfdis,:0,:27,:540,:Gisla
55,"Álfgeirr, jarl í Norðimbralandi, ",Álfgeirr,,,,,,,,
56,"Álfgeirr, landnm. á Álfgeirsvöllum, ",Álfgeirr,,,,,,,,
57,"Álfgeirr, Suðreyingr, ",Álfgeirr,11,Alfgeir (Earl in Northumbria),:3,Alfgeir,:1,:-1,:-1,:Eyrbyggja
58,"Alfgerðr Arngeirsdóttir ins austræna, kona Þorgeirs Ljósvetningagoða, ",Alfgerðr Arngeirsdóttir ins austræna,,,,,,,,
59,"Álfgerðr læknir, at Ekkjufelli, ",Álfgerðr læknir,,,,,,,,
60,"Álfgerðr Þorleifsdóttir beiskalda, ",Álfgerðr Þorleifsdóttir beiskalda,,,,,,,,
61,"Álfgerðr Þórormsdóttir, ",Álfgerðr Þórormsdóttir,,,,,,,,
62,"Álfheiðr Vetrliðadóttir skálds, kona Högna Gunnarssonar, ",Álfheiðr Vetrliðadóttir skálds,,,,,,,,
63,"Álfheiðr Þorleifsdóttir beiskalda (Álfgerðr), kona Grundar-Ketils Þorsteinssonar, ",Álfheiðr Þorleifsdóttir beiskalda (Álfgerðr),,,,,,,,
64,"Álfheiðr Þorvaldsdóttir ins auðga, kona Gizurar Hallssonar, ",Álfheiðr Þorvaldsdóttir ins auðga,,,,,,,,
65,"Álfhildr, kona Kolla á Sauðanesi, svo fylgikona Víga-Skútu, ",Álfhildr,,,,,,,,
66,"Álfhildr, konungsambátt, ",Álfhildr,,,,,,,,
67,"Alfífa Álfrinsdóttir, drottning, ",Alfífa Álfrinsdóttir,,,,,,,,
68,"Álfr aftrkemba, í Sandey, ",Álfr aftrkemba,,,,,,,,
69,"Álfr askmaðr Özurarson tóta (Askmaðr), bróðir Gunnhildar drottningar, ",Álfr askmaðr Özurarson tóta (Askmaðr),6,Alf Askmann (brother of Queen Gunnhild),:182,Alf Askman,:1,:-1,:-1,:Egil
70,"Álfr Eysteinsson, í Dölum (Dala-Álfr), ",Álfr Eysteinsson,7,Alf of Dalir,:390:1,Alf of Dalir,:1:1,:6:-1,:280:-1,:Laxdoela:Eyrbyggja
71,"Álfr Finnbogason ramma, ",Álfr Finnbogason ramma,,,,,,,,
72,"Álfr goði, faðir Valla-Ljóts, ",Álfr goði,,,,,,,,
73,"Álfr inn auðgi, ",Álfr inn auðgi,8,Alf the Wealthy (farmer by Eidaskog),:239,Alf the Wealthy,:1,:-1,:-1,:Egil
74,"Álfr inn egzki, landnm. at Geipum, ",Álfr inn egzki,,,,,,,,
75,"Álfr inn litli, í Þambárdal, ",Álfr inn litli,,,,,,,,
76,"Álfr Þórarinsson, í Þambárdal, ",Álfr Þórarinsson,,,,,,,,
77,"Álfr, á Vors, ",Álfr,,,,,,,,
78,"Álfr, hersir í Þrándheimi, ",Álfr,,,,,,,,
79,"Álfr, í Ostu, ",Álfr,,,,,,,,
80,"Áli Oddsson (rangt Þorvarðsson) inn auðgi, á Söndum, ",Áli Oddsson (rangt Þorvarðsson) inn auðgi,,,,,,,,
81,"Áli Svarthöfðason ok Herdísar Oddsdóttur, Álasonar (ekki Herdísar Hrafnsdóttur; Óli), ",Áli Svarthöfðason ok Herdísar Oddsdóttur,,,,,,,,
82,"Áli Þorvarðsson, ",Áli Þorvarðsson,,,,,,,,
83,"Áli, sækonungr, ",Áli,,,,,,,,
84,"Álöf árbót Haraldsdóttir hárfagra, kona Þóris jarls þegjandi, ",Álöf árbót Haraldsdóttir hárfagra,,,,,,,,
85,"Álöf Arnþjófsdóttir, kona Halls Órækjusonar, ",Álöf Arnþjófsdóttir,,,,,,,,
86,"Álöf Böðvarsdóttir hersis (Ólöf), kona Teits Ketilbjarnarsonar, ",Álöf Böðvarsdóttir hersis (Ólöf),,,,,,,,
87,"Álöf Brynjólfsdóttir (Brunnólfsdóttir), kona Grímkels á Vörs, ",Álöf Brynjólfsdóttir (Brunnólfsdóttir),,,,,,,,
88,"Álöf elliðaskjöldr Ófeigsdóttir (Ólöf), kona Þórbergs kornamúla, ",Álöf elliðaskjöldr Ófeigsdóttir (Ólöf),,,,,,,,
89,"Álöf Erlingsdóttir ins auðga úr Ostr, seinni kona Bjarnar hölds, ",Álöf Erlingsdóttir ins auðga úr Ostr,634,Olof Erlingsdottir,:143,Olof Erlingsdottir,:1,:-1,:-1,:Egil
90,"Álöf Guðmundardóttir (Ólöf), kona Eyjólfs á Borg inni syðri í Víðidal, ",Álöf Guðmundardóttir (Ólöf),,,,,,,,
91,"Álöf Ingólfsdóttir, kona Eiríks snöru landnm. í Árnesi, ",Álöf Ingólfsdóttir,,,,,,,,
92,"Álöf kjannök (Kjannök) fóstra Guðmundarsona, ",Álöf kjannök (Kjannök) fóstra Guðmundarsona,,,,,,,,
93,"Álöf Özurardóttir, kona Kols Síðu-Hallssonar, ",Álöf Özurardóttir,,,,,,,,
94,"Álöf Ragnarsdóttir loðbrókar (Ólöf), kona Hunda-Steinars jarls, ",Álöf Ragnarsdóttir loðbrókar (Ólöf),,,,,,,,
95,"Álöf Snorradóttir goða, kona Jörundar Þorfinnssonar, ",Álöf Snorradóttir goða,,,,,,,,
96,"Álöf Þórðardóttir vaggagða (Sigríðr), kona Ásbjarnar jarls skerjablesa og síðar Gríms landnm. í Grímsnesi, ",Álöf Þórðardóttir vaggagða (Sigríðr),,,,,,,,
97,"Álöf Þorgrímsdóttir þönguls, ",Álöf Þorgrímsdóttir þönguls,,,,,,,,
98,"Álöf Þorsteinsdóttir rauðs (Ólöf), í Færeyjum, ",Álöf Þorsteinsdóttir rauðs (Ólöf),,,,,,,,
99,"Álöf Þorvarðsdóttir (Þorvaldsdóttir), Síðu-Hallssonar, fyrri kona eða fylgikona Halldórs Snorrasonar goða, móðir Guðrúnar í Vatnsfirði, ",Álöf Þorvarðsdóttir (Þorvaldsdóttir),,,,,,,,
100,"Alrekr Dagsson, Svíakonungr, ",Alrekr Dagsson,,,,,,,,
101,"Alrekr Hrappsson, faðir Ljótólfs goða á Völlum í Svarfaðardal, ",Alrekr Hrappsson,,,,,,,,
102,"Alrekr Þormóðarson ins ramma, ",Alrekr Þormóðarson ins ramma,,,,,,,,
103,"Ámr, jötunn, ",Ámr,,,,,,,,
104,"Ámr, úr Miðfjarðarnesbjörgum, ",Ámr,,,,,,,,
105,"Ámundi inn blindi Höskuldsson, ",Ámundi inn blindi Höskuldsson,,,,,,,,
106,"Ámundi inn hvíti, ",Ámundi inn hvíti,,,,,,,,
107,"Ámundi Þorgeirsson (Þórarinssonar skálds, Skeggjasonar, bróðir Æsu í Odda), ",Ámundi Þorgeirsson (Þórarinssonar skálds Skeggjasonar bróðir Æsu í Odda),,,,,,,,
108,"Ámundi Þorsteinsson, Síðu-Hallssonar, ",Ámundi Þorsteinsson,,,,,,,,
109,"Án Arnarson hyrnu (Onarr Þórisson, Unarr Arnarson), ",Án Arnarson hyrnu (Onarr Þórisson Unarr Arnarson),,,,,,,,
110,"Án bogsveigir Bjarnarson, í Hrafnistu, ",Án bogsveigir Bjarnarson,15,An Bow-bender,:3:45,An Bow-bender,:1:1,:1:4,:189:504,:Vatnsdal:Gisla
111,"Án hrísmagi eða inn svarti, ",Án hrísmagi eða inn svarti,17,An the Black/Twig-belly,:483,An the Black,:1,:24,:315,:Laxdoela
112,"Án inn heimski, grænlenzkr maðr, ",Án inn heimski,,,,,,,,
113,"Án inn hvíti, ",Án inn hvíti,18,An the White,:482,An the White,:1,:24,:315,:Laxdoela
114,"Án inn rammi Þorsteinsson, ",Án inn rammi Þorsteinsson,,,,,,,,
115,"Án rauðfeldr Grímsson loðinkinna, landnm., á Eyri í Arnarfirði, ",Án rauðfeldr Grímsson loðinkinna,16,An Grimsson Red-cloak (son of Grim Ketilsson Hairy-cheeks),:39,An Red-cloak,:1,:4,:504,:Gisla
116,"Án trúðr, at Gunnlaugarstöðum, ",Án trúðr,,,,,,,,
117,"Án Þórisson farmanns, ",Án Þórisson farmanns,,,,,,,,
118,"Án, á Ásbrandsstöðum, ",Án,,,,,,,,
119,"Án, í Hrauni, ",Án,,,,,,,,
120,"Án, í Kirkjufelli, ",Án,,,,,,,,
121,"Ánakol, bóndi á Írlandi, ",Ánakol,,,,,,,,
122,"Andríðr, í Brautarholti, ",Andríðr,,,,,,,,
123,"Áni, á Ánabrekku, ",Áni,19,Ani at Anabrekka (one of Skallagrim's men),:93,"Ani, Skallagrim's man",:1,:-1,:-1,:Egil
124,"Ari Högnason í Hjaltlandi, ",Ari Högnason í Hjaltlandi,,,,,,,,
125,"Ari Loðmundarson ins gamla, ",Ari Loðmundarson ins gamla,,,,,,,,
126,"Ari Másson, á Reykjahólum, ",Ari Másson,20,Ari Masson (of Reykjanes),:398,Ari Masson,:1,:6,:280,:Laxdoela
127,"Ari Súrsson (Þorbjarnarson súrs), ",Ari Súrsson (Þorbjarnarson súrs),21,Ari Sursson (brother of Gisli Sursson),:16,Ari,:1,:2,:501,:Gisla
128,"Ari Tannason, ",Ari Tannason,,,,,,,,
129,"Ari Vetrliðason skálds, ",Ari Vetrliðason skálds,,,,,,,,
130,"Ari Þjóðarsson, ",Ari Þjóðarsson,,,,,,,,
131,"Ari Þorbjarnarson súrs, ",Ari Þorbjarnarson súrs,,,,,,,,
132,"Ari Þorgeirsson, faðir Guðmundar byskups, ",Ari Þorgeirsson,,,,,,,,
133,"Ari Þorgilsson á Reykjahólum, ",Ari Þorgilsson á Reykjahólum,,,,,,,,
134,"Ari Þorgilsson inn fróði, á Stað á Snæfellsnesi, ",Ari Þorgilsson inn fróði,22,Ari Thorgilsson the Learned,:703:4,Ari the Learned,:2:1,:78:-1,:420:-1,:Laxdoela:Eyrbyggja
135,"Ari Þorgilsson inn sterki, á Stað á Snæfellsnesi, ",Ari Þorgilsson inn sterki,23,Ari Thorgilsson the Strong,:685,Ari the Strong,:1,:78,:420,:Laxdoela
136,"Ari Þorkelsson, í Súrnadal, ",Ari Þorkelsson,24,Ari Thorkelsson (Skerauki),:3,Ari,:1,:1,:500,:Gisla
137,"Ari, at Sandgili, ",Ari,,,,,,,,
138,"Arinbjörn eldri, hersir í Fjörðum, ",Arinbjörn eldri,,,,,,,,
139,"Arinbjörn Þórisson hersir, ",Arinbjörn Þórisson hersir,25,Arinbjorn Thorisson the Hersir,:169,Arinbjorn Thorarson,:1,:-1,:-1,:Egil
140,"Ármann Dalmannsson, í Ármannsfelli, ",Ármann Dalmannsson,,,,,,,,
141,"Ármann Hallvarðsson, í Noregi, ",Ármann Hallvarðsson,,,,,,,,
142,"Ármóðr Arnviðarson jarl (réttara Arnmóðr), ",Ármóðr Arnviðarson jarl (réttara Arnmóðr),,,,,,,,
143,"Ármóðr inn gamli Þorgrímsson, í Þykkvaskógi, ",Ármóðr inn gamli Þorgrímsson,26,Armod (of Thykkvaskog),:553,Armod,:1,:33,:328,:Laxdoela
144,"Ármóðr inn rauði Þorbjarnarson, landnm. á Rauðasandi, ",Ármóðr inn rauði Þorbjarnarson,,,,,,,,
145,"Ármóðr skegg, bóndi við Eiðaskóg, ",Ármóðr skegg,27,Armod Beard (wealthy farmer by Eidaskog),:234,Armod Beard,:1,:-1,:-1,:Egil
146,"Arnaldr (Arnaldus), patriarki í Jerúsalem, ",Arnaldr (Arnaldus),,,,,,,,
147,"Arnaldr Sæmundarson, ",Arnaldr Sæmundarson,29,Arnald Saemundarson,:76,Arnald Saemundarson,:1,:24,:225,:Vatnsdal
148,"Arnaldr, bóndi við Eiðaskóg, ",Arnaldr,28,Arnald (farmer in Eidaskog),:233,Arnald,:1,:-1,:-1,:Egil
149,"Arnaldr, byskup á Grænlandi, ",Arnaldr,,,,,,,,
150,"Arnbjörg Brandsdóttir, kona Arnórs Þorgeirssonar, ",Arnbjörg Brandsdóttir,,,,,,,,
151,"Arnbjörg Kampa-Grímsdóttir, kona Ásólfs flosa í Höfða, ",Arnbjörg Kampa-Grímsdóttir,,,,,,,,
152,"Arnbjörg Ráðormsdóttir, kona Svertings Hrólfssonar, síðar Gnúps Molda-Gnúpssonar, ",Arnbjörg Ráðormsdóttir,,,,,,,,
153,"Arnbjörg Þórðardóttir, frá Höfða, ",Arnbjörg Þórðardóttir,,,,,,,,
154,"Arnbjörg, at Arnbjargarlæk, ",Arnbjörg,,,,,,,,
155,"Arnbjörn inn sterki Ásbrandsson, frá Kambi í Breiðavík, ",Arnbjörn inn sterki Ásbrandsson,,,,,,,,
156,"Arnbjörn Óláfsson langháls (Ásbjörn), ",Arnbjörn Óláfsson langháls (Ásbjörn),,,,,,,,
157,"Arnbjörn Sleitu-Bjarnarson, ",Arnbjörn Sleitu-Bjarnarson,31,Arnbjorn Sleitu-Bjarnarson,:473,Arnbjorn,:1,:20,:303,:Laxdoela
158,"Arnbjörn, Austmaðr, ",Arnbjörn,,,,,,,,
159,"Arnbjörn, frændi Þorfinns Kárssonar, ",Arnbjörn,,,,,,,,
160,"Arndís Geirmundardóttir heljarskinns, kona Hyrnings Óláfssonar, ",Arndís Geirmundardóttir heljarskinns,,,,,,,,
161,"Arndís Heðinsdóttir, kona Heðins, ",Arndís Heðinsdóttir,,,,,,,,
162,"Arndís in auðga Steinólfsdóttir ins lága, landnámskona í Bæ í Hrútafirði, ",Arndís in auðga Steinólfsdóttir ins lága,,,,,,,,
163,"Arndís Styrbjarnardóttir, kona Hamals Þormóðarsonar, ",Arndís Styrbjarnardóttir,,,,,,,,
164,"Arndís Þórðardóttir skeggja, kona Þorgríms goða Helgasonar, ",Arndís Þórðardóttir skeggja,,,,,,,,
165,"Arndís Þorkelsdóttir ins háva (Hallfríðr), kona Vígfúss Eyjólfssonar á Þverá, ",Arndís Þorkelsdóttir ins háva (Hallfríðr),,,,,,,,
166,"Arneiðr, ",Arneiðr,,,,,,,,
167,"Arnfiðr, jarl á Hallandi, ",Arnfiðr,32,Arnfinn (Earl in Halland),:177,Earl Arnfinn in Halland,:1,:-1,:-1,:Egil
168,"Arnfinnr inn víkverski, farmaðr",Arnfinnr inn víkverski,,,,,,,,
169,"Arnfinnr Torf-Einarsson, jarl í Orkneyjum, ",Arnfinnr Torf-Einarsson,,,,,,,,
170,"Arnfríðr Sleitu-Bj arnardóttir, kona Spak-Böðvars, ",Arnfríðr Sleitu-Bj arnardóttir,,,,,,,,
171,"Arnfríðr Þorsteinsdóttir, kona Digr-Helga, ",Arnfríðr Þorsteinsdóttir,,,,,,,,
172,"Arngeirr Bersason í Hólmi í Hítardal, ",Arngeirr Bersason í Hólmi í Hítardal,35,Arngeir Bersason (from Holm),:195,Arngeir of Holm,:1,:-1,:-1,:Egil
173,"Arngeirr inn austræni, ",Arngeirr inn austræni,,,,,,,,
174,"Arngeirr inn hvassi Þormóðarson ins ramma, ",Arngeirr inn hvassi Þormóðarson ins ramma,,,,,,,,
175,"Arngeirr Sæbjarnarson goða, ",Arngeirr Sæbjarnarson goða,,,,,,,,
176,"Arngeirr Spak-Böðvarsson, ",Arngeirr Spak-Böðvarsson,,,,,,,,
177,"Arngeirr, bóndi á Steinum, ",Arngeirr,,,,,,,,
178,"Arngeirr, landnámsmaðr á Sléttu, ",Arngeirr,,,,,,,,
179,"Arngerðr Ásbrandsdóttir, Þorbrandssonar, ",Arngerðr Ásbrandsdóttir,,,,,,,,
180,"Arngerðr Þorbjarnardóttir, kona Þjóðreks Sleitu-Bjarnarsonar, ",Arngerðr Þorbjarnardóttir,,,,,,,,
181,"Arngerðr Þorkelsdóttir, kona Þorkels Torfasonar at Skáney, ",Arngerðr Þorkelsdóttir,,,,,,,,
182,"Arngerðr, kona Þormóðar ins ramma, ",Arngerðr,,,,,,,,
183,"Arngrímr goði Helgason, í Norðtungu, ",Arngrímr goði Helgason,,,,,,,,
184,"Arngrímr Guðmundarson, ",Arngrímr Guðmundarson,,,,,,,,
185,"Arngrímr Helgason bjólu, ",Arngrímr Helgason bjólu,,,,,,,,
186,"Arngrímr Þorgrímsson, ",Arngrímr Þorgrímsson,,,,,,,,
187,"Arngrímr Þorgrímsson, í Möðrufelli, ",Arngrímr Þorgrímsson,,,,,,,,
188,"Arngrímr Þorsteinsson, á Framnesi, ",Arngrímr Þorsteinsson,,,,,,,,
189,"Arngrímr, fóstri Auðólfs á Auðólfsstöðum, ",Arngrímr,,,,,,,,
190,"Arnguðr, ",Arnguðr,,,,,,,,
191,"Arngunnr Hámundardóttir (Arnguðr), kona Hróars Tungugoða,",Arngunnr Hámundardóttir (Arnguðr),,,,,,,,
192,"Arngunnr Þorsteinsdóttir drangakarls, kona Sigmundar kleykis, ",Arngunnr Þorsteinsdóttir drangakarls,,,,,,,,
193,"Arnhaldr Sæmundarson ins suðreyska (Arnaldr, Arnhallr), ",Arnhaldr Sæmundarson ins suðreyska (Arnaldr Arnhallr),,,,,,,,
194,"Arnhaldr, bróðir Sæmundar ins suðreyska, ",Arnhaldr,,,,,,,,
195,"Arnhallr Sæmundarson, ",Arnhallr Sæmundarson,,,,,,,,
196,"Arnheiðr Asbjarnardóttir jarls, kona Ketils á Arnheiðarstöðum, ",Arnheiðr Asbjarnardóttir jarls,,,,,,,,
197,"Arnheiðr Helgadóttir, kona Björgólfs jarls, ",Arnheiðr Helgadóttir,,,,,,,,
198,"Arnhöfði víkingr, ",Arnhöfði víkingr,,,,,,,,
199,"Arni Ármóðsson, ",Arni Ármóðsson,,,,,,,,
200,"Arni Árnason, norskr höfðingi, ",Arni Árnason,,,,,,,,
201,"Arni fjöruskeifr (Fjöruskeifr), ",Arni fjöruskeifr (Fjöruskeifr),,,,,,,,
202,"Arni Kolsson, ",Arni Kolsson,,,,,,,,
203,"Arni Skeggjason (Sigurðr), á Flyðrunesi, ",Arni Skeggjason (Sigurðr),37,Ami Skeggjason (the Dueller),:23,Arni Skeggjason,:1,:3,:503,:Gisla
204,"Arni Torfuson (eða Torfason), ",Arni Torfuson (eða Torfason),,,,,,,,
205,"Arni Víga-Gunnarsson, ",Arni Víga-Gunnarsson,,,,,,,,
206,"Arni Þórðarson hirðstjóri, ",Arni Þórðarson hirðstjóri,,,,,,,,
207,"Arni Þorgautsson, at Hávafelli, ",Arni Þorgautsson,,,,,,,,
208,"Arni Þorláksson, byskup í Skálaholti (Staða-Árni), ",Arni Þorláksson,,,,,,,,
209,"Arni, fylgdarmaðr Steinólfs ins lága, ",Arni,,,,,,,,
210,"Arnis ábóti Bjarnarson ins enska, ",Arnis ábóti Bjarnarson ins enska,,,,,,,,
211,"Arnkatla Þórðardóttir, Ingunnarsonar, ",Arnkatla Þórðardóttir,,,,,,,,
212,"Arnkatla Þorsteinsdóttir vífils, kona Surts Ásbjarnarsonar í Kirkjubæ, ",Arnkatla Þorsteinsdóttir vífils,,,,,,,,
213,"Arnkell goði Þórólfsson, á Bólstað, ",Arnkell goði Þórólfsson,,,,,,,,
214,"Arnlaugr, landnm. á Grænlandi, ",Arnlaugr,,,,,,,,
215,"Arnleif Illugadóttir ins ramma, kona Kolls Þórðarsonar blígs, ",Arnleif Illugadóttir ins ramma,,,,,,,,
216,"Arnleif in katneska, kona Þórólfs viligísls, ",Arnleif in katneska,,,,,,,,
217,"Arnleif Þórðardóttir gellis, kona Ásláks í Langadal, ",Arnleif Þórðardóttir gellis,,,,,,,,
218,"Arnleif Þórðardóttir, frá Höfða, ",Arnleif Þórðardóttir,,,,,,,,
219,"Arnljótr gellini, stígamaðr, ",Arnljótr gellini,,,,,,,,
220,"Arnljótr inn auðgi Gautason, at Miðfelli, ",Arnljótr inn auðgi Gautason,,,,,,,,
221,"Arnljótr sterki, jarl í Svíþjóð, ",Arnljótr sterki,,,,,,,,
222,"Arnljótr sýslumaðr, í Suðreyjum, ",Arnljótr sýslumaðr,,,,,,,,
223,"Arnljótr Þóroddsson hjálms, ",Arnljótr Þóroddsson hjálms,,,,,,,,
224,"Arnmóðr Heðinsson ins milda, ",Arnmóðr Heðinsson ins milda,,,,,,,,
225,"Arnmóðr inn skjálgi Þorkelsson vingnis, ",Arnmóðr inn skjálgi Þorkelsson vingnis,,,,,,,,
226,"Arnmóðr jarl Nereiðsson jarls ins gamla, ",Arnmóðr jarl Nereiðsson jarls ins gamla,,,,,,,,
227,"Arnoddr Óláfsson bekks, ",Arnoddr Óláfsson bekks,,,,,,,,
228,"Arnoddr Sleitu-Bjarnarson, ",Arnoddr Sleitu-Bjarnarson,,,,,,,,
229,"Arnoddr, heimamaðr á Eiðum, ",Arnoddr,,,,,,,,
230,"Arnóra Einarsdóttir, frá Laugarbrekku (ekki Lón-Einars), kona Þorgeirs Vífilssonar, ",Arnóra Einarsdóttir,,,,,,,,
231,"Arnóra Gunnbjarnardóttir, kona Kolbeins Þórðarsonar, ",Arnóra Gunnbjarnardóttir,,,,,,,,
232,"Arnóra Steinsdóttir, Þorfinnssonar, kona Þorgeirs Þórhaddssonar í Hítardal, ",Arnóra Steinsdóttir,,,,,,,,
233,"Arnóra Þórðardóttir gellis, kona Þorgests Steinssonar, ",Arnóra Þórðardóttir gellis,,,,,,,,
234,"Arnóra Þorgeirsdóttir ins óða, kona Brúna ins hvíta, ",Arnóra Þorgeirsdóttir ins óða,,,,,,,,
235,"Arnóra Þorsteinsdóttir tjaldstæðings, ",Arnóra Þorsteinsdóttir tjaldstæðings,,,,,,,,
236,"Arnórr Arndísarson, ",Arnórr Arndísarson,,,,,,,,
237,"Arnórr Birnuson, ",Arnórr Birnuson,,,,,,,,
238,"Arnórr Herlaugsson, ",Arnórr Herlaugsson,,,,,,,,
239,"Arnórr Hrútsson, Herjólfssonar, ",Arnórr Hrútsson,,,,,,,,
240,"Arnórr hýnefr Þóroddsson, ",Arnórr hýnefr Þóroddsson,,,,,,,,
241,"Arnórr inn góði Steinólfsson Rauðæingr (rauðkinnr), ",Arnórr inn góði Steinólfsson Rauðæingr (rauðkinnr),,,,,,,,
242,"Arnórr jarlaskáld Þórðarson, ",Arnórr jarlaskáld Þórðarson,40,Arnor the Earl's Poet,:686,Arnor the Earl's Poet,:1,:78,:420,:Laxdoela
243,"Arnórr kerlingarnef Bjarnarson, á Miklabæ í Óslandshlíð, ",Arnórr kerlingarnef Bjarnarson,,,,,,,,
244,"Arnórr Nafar-Helgason (Aron), ",Arnórr Nafar-Helgason (Aron),,,,,,,,
245,"Arnórr Örnólfsson, í Forsárskógum, ",Arnórr Örnólfsson,,,,,,,,
246,"Arnórr Skefilsson, í Gönguskarði, ",Arnórr Skefilsson,,,,,,,,
247,"Arnórr Þorbjarnarson öxnamegins, ",Arnórr Þorbjarnarson öxnamegins,,,,,,,,
248,"Arnórr Þorgrímsson, í Reykjahlið, ",Arnórr Þorgrímsson,,,,,,,,
249,"Arnórr Þórisson, Helgasonar, ",Arnórr Þórisson,,,,,,,,
250,"Arnórr Þorkelsson kröflu, ",Arnórr Þorkelsson kröflu,,,,,,,,
251,"Arnórr Þorkelsson skeifs, Ketilssonar gufu, ",Arnórr Þorkelsson skeifs,,,,,,,,
252,"Arnórr þvari, á Saxahváli, ",Arnórr þvari,,,,,,,,
253,"Arnórr, smiðr Víga-Skútu, ",Arnórr,38,Arnor ('a noisy fellow'),:55,Arnor,:1,:5,:505,:Gisla
254,"Arnórr, vestfirzkr maðr, ",Arnórr,,,,,,,,
255,"Arnríðr Heðinsdóttir, kona Ketils Fjörleifarsonar, ",Arnríðr Heðinsdóttir,,,,,,,,
256,"Arnsteinn goði Reistarson, ",Arnsteinn goði Reistarson,,,,,,,,
257,"Arnviðr, jarl á Vermalandi, ",Arnviðr,43,Arnvid (Earl in Varmland),:339,Earl Arnvid,:1,:-1,:-1,:Egil
258,"Arnviðr, jarl í Gautlandi inu eystra, ",Arnviðr,,,,,,,,
259,"Arnviðr, konungr á Sunnmæri, ",Arnviðr,,,,,,,,
260,"Arnþórr, á Sveinsstöðum, ",Arnþórr,,,,,,,,
261,"Arnþórr, féhirðir Gunnhildar drottningar, ",Arnþórr,,,,,,,,
262,"Arnþrúðr Arinbjarnardóttir, kona Þóris hersis Hróarssonar, ",Arnþrúðr Arinbjarnardóttir,,,,,,,,
263,"Arnþrúðr, ambátt Hallfreðar, ",Arnþrúðr,42,Arnthrud (slave),:10,Arnthrud,:0,:1,:438,:Hrafnkel
264,"Aron Nafar-Helgason, ",Aron Nafar-Helgason,,,,,,,,
265,"Aron Úlfsson, í Úlfsdölum, ",Aron Úlfsson,,,,,,,,
266,"Ása Hrólfsdóttir rauðskeggs, ",Ása Hrólfsdóttir rauðskeggs,,,,,,,,
267,"Ása, frændkona Víðkunns í Bjarkey, ",Ása,,,,,,,,
268,"Ása, kona Gunnbjarnar Finnbogasonar ramma, ",Ása,,,,,,,,
269,"Ásbjörn Arnórsson, í Skagafirði, ",Ásbjörn Arnórsson,,,,,,,,
270,"Ásbjörn Auðunarson stota, ",Ásbjörn Auðunarson stota,,,,,,,,
271,"Ásbjörn Eyvindarson dettiáss (Gunnbjarnarson), ",Ásbjörn Eyvindarson dettiáss (Gunnbjarnarson),,,,,,,,
272,"Ásbjörn Finnbogason ins ramma, ",Ásbjörn Finnbogason ins ramma,,,,,,,,
273,"Ásbjörn Gunnbjarnarson dettiáss, ",Ásbjörn Gunnbjarnarson dettiáss,,,,,,,,
274,"Ásbjörn Heyangrs-Bjarnarson, ",Ásbjörn Heyangrs-Bjarnarson,,,,,,,,
275,"Ásbjörn Hrafnkelsson Freysgoða, ",Ásbjörn Hrafnkelsson Freysgoða,48,Asbjorn Hrafnkelsson (Frey's Godi),:14,Asbjorn,:1,:2,:439,:Hrafnkel
276,"Ásbjörn Hreiðarsson, ",Ásbjörn Hreiðarsson,,,,,,,,
277,"Ásbjörn Hrossbjarnarson Myrkárskalli, ",Ásbjörn Hrossbjarnarson Myrkárskalli,,,,,,,,
278,"Ásbjörn inn auðgi Harðarson, landnm. at Ásbjarnarstöðum, ",Ásbjörn inn auðgi Harðarson,47,Asbjorn Hardarson the Wealthy,:377,Asbjorn the Wealthy,:1,:6,:280,:Laxdoela
279,"Ásbjörn inn prúði Virfilsson, ",Ásbjörn inn prúði Virfilsson,,,,,,,,
280,"Ásbjörn kastanrazi, farmaðr, ",Ásbjörn kastanrazi,,,,,,,,
281,Ásbjörn Ketilsson (Þorsteinsson) í Kirkjubæ,Ásbjörn Ketilsson (Þorsteinsson) í Kirkjubæ,49,Asbjorn Ketilsson,:343,Asbjorn,:1,:1,:276,:Laxdoela
282,"Ásbjörn Kjallaksson vöðvi, á Orrastöðum, ",Ásbjörn Kjallaksson vöðvi,,,,,,,,
283,"Ásbjörn kjötvi, ",Ásbjörn kjötvi,,,,,,,,
284,"Ásbjörn Krumsson, ",Ásbjörn Krumsson,,,,,,,,
285,"Ásbjörn loðinhöfði, ",Ásbjörn loðinhöfði,,,,,,,,
286,"Ásbjörn Ófeigsson grettis, ",Ásbjörn Ófeigsson grettis,,,,,,,,
287,"Ásbjörn Óláfsson langháls, ",Ásbjörn Óláfsson langháls,,,,,,,,
288,"Ásbjörn Ozurarson, landnm. á Skúlastöðum, ",Ásbjörn Ozurarson,,,,,,,,
