Canonical_ID,Original_Name,Full_Name,Smiley_ID,Smiley_Name,URAP_ID,URAP_Name,Gender,Chapter,Page,Saga
5520,"Yngvildr Steinröðardóttir, kona Styrbjarnar Þórarinssonar, ",Yngvildr Steinröðardóttir,,,,,,,,
5521,"Yngvildr Þorgeirsdóttir, kona Sæmundar Grímssonar, ",Yngvildr Þorgeirsdóttir,,,,,,,,
5522,"Yngvildr Þorgeirsdóttir, kona Þorgeirs Eiríkssonar, ",Yngvildr Þorgeirsdóttir,,,,,,,,
5523,"Yngvildr Þorgeirsdóttir, kona Þorsteins Snorrasonar goða, ",Yngvildr Þorgeirsdóttir,,,,,,,,
5524,"Yngvildr Þorgrímsdóttir Digr-Ketilssonar ok Þorgerðar Kolsdóttur, ",Yngvildr Þorgrímsdóttir Digr-Ketilssonar ok Þorgerðar Kolsdóttur,,,,,,,,
5525,"Yngvildr Þorkelsdóttir fullspaks, kona Ketils þryms Þiðrandasonar, ",Yngvildr Þorkelsdóttir fullspaks,,,,,,,,
5526,"Yngvildr Þorkelsdóttir meinakrs (Þórhildr), kona Þorgríms goða Kjallakssonar, ",Yngvildr Þorkelsdóttir meinakrs (Þórhildr),,,,,,,,
5527,"Yrr Geirmundar dóttir heljarskinns, kona Ketils gufu Örlygssonar, ",Yrr Geirmundar dóttir heljarskinns,1163,Yr Geirmundardottir (Dark-skin),:251,Yr Dark skin,:0,:-1,:-1,:Egil
5528,"Yxna-Þórir, ",Yxna-Þórir,,,,,,,,
5529,"Þangbrandr Vilbaldsson inn saxneski, prestr, kristniboði, ",Þangbrandr Vilbaldsson inn saxneski,812,Thangbrand Vilbaldusson (missionary),:599,Thangbrand,:1,:41,:352,:Laxdoela
5530,"Þengill mjöksiglandi, af Hálogalandi, landnm. at Höfða í Höfðahverfi, ",Þengill mjöksiglandi,,,,,,,,
5531,"Þengill Þorgilsson, ",Þengill Þorgilsson,,,,,,,,
5532,"Þiðrandabani, ",Þiðrandabani,,,,,,,,
5533,"Þiðrandi Geitisson, í Njarðvík, ",Þiðrandi Geitisson,814,Thidrandi Geitisson of Krossavik,:654,Thidrandi Geitisson of Krossavik,:1,:69,:404,:Laxdoela
5534,"Þiðrandi inn háleygski, at Tjörn, ",Þiðrandi inn háleygski,,,,,,,,
5535,"Þiðrandi Ketilsson inn gamli, í Njarðvík, ",Þiðrandi Ketilsson inn gamli,,,,,,,,
5536,"Þiðrandi Síðu-Hallsson, ",Þiðrandi Síðu-Hallsson,,,,,,,,
5537,"Þjóðarr Friðleifsson, ",Þjóðarr Friðleifsson,,,,,,,,
5538,"Þjóðgeirr, heimamaðr í Njarðvík, ",Þjóðgeirr,,,,,,,,
5539,"Þjóðgerðr Flókadóttir, fyrri kona Eilífs arnar Atlasonar, móðir Eysteins, Koðráns ok Þjóðólfs, ",Þjóðgerðr Flókadóttir,,,,,,,,
5540,"Þjóðgerðr Koðránsdóttir, frá Giljá, fylgikona Guðmundar ríka Eyjólfssonar, móðir Koðráns, ",Þjóðgerðr Koðránsdóttir,,,,,,,,
5541,"Þjóðhildr Eyvindardóttir Austmanns, kona Þórðar Víkingssonar í Alviðru, ",Þjóðhildr Eyvindardóttir Austmanns,,,,,,,,
5542,"Þjóðhildr Jörundardóttir, kona Eiríks rauða, ",Þjóðhildr Jörundardóttir,,,,,,,,
5543,"Þjóðhildr Þorkelsdóttir fullspaks, kona Ævars Þorgeirssonar, ",Þjóðhildr Þorkelsdóttir fullspaks,,,,,,,,
5544,"Þjóðólfr Arnórsson eða Þorljótsson, skáld, ",Þjóðólfr Arnórsson eða Þorljótsson,,,,,,,,
5545,"Þjóðólfr Eilífsson arnar, goði at Hofi á Skagaströnd, ",Þjóðólfr Eilífsson arnar,,,,,,,,
5546,"Þjóðólfr inn lági, í Höfn (Knarrarhöfn), í Hvammssveit, ",Þjóðólfr inn lági,816,Thjodolf the Short,:534,Thjodolf the Short,:1,:32,:327,:Laxdoela
5547,"Þjóðólfr Karlason, á Karlastöðum, ",Þjóðólfr Karlason,,,,,,,,
5548,"Þjóðólfr ór Hvini, skáld, ",Þjóðólfr ór Hvini,,,,,,,,
5549,"Þjóðólfr, af Æsustöðum, ",Þjóðólfr,,,,,,,,
5550,"Þjóðrekr Sléttu-Bjarnarson, á Þverfelli í Saurbæ, svo á Arngerðareyri, ",Þjóðrekr Sléttu-Bjarnarson,,,,,,,,
5551,"Þjóðrekr Sturluson, ",Þjóðrekr Sturluson,,,,,,,,
5552,"Þjóðrekr Þjóðreksson, Sléttu-Bjarnarsonar, ",Þjóðrekr Þjóðreksson,,,,,,,,
5553,"Þjóðrekr, landnm. í Skála, ",Þjóðrekr,,,,,,,,
5554,"Þjóstarr, á Álftanesi, ",Þjóstarr,,,,,,,,
5555,"Þjóstólfr Bjarnarson gullbera, at Lundi, ",Þjóstólfr Bjarnarson gullbera,,,,,,,,
5556,"Þjóstólfr Þorkelsson inn hamrammi, ",Þjóstólfr Þorkelsson inn hamrammi,,,,,,,,
5557,"Þjóstólfr, í Engihlíð (Þróttólfr), ",Þjóstólfr,,,,,,,,
5558,"Þjóstólfr, suðreyskr maðr, fóstri Hallgerðar, ",Þjóstólfr,,,,,,,,
5559,"Þögn, valkyrja, ",Þögn,,,,,,,,
5560,"Þór álfr Þorbjarnarson, ",Þór álfr Þorbjarnarson,,,,,,,,
5561,"Þóra Bárðardóttir Snæfellsáss, ",Þóra Bárðardóttir Snæfellsáss,,,,,,,,
5562,"Þóra Bárðardóttir, í Úlfsdölum, ",Þóra Bárðardóttir,,,,,,,,
5563,"Þóra Bjarnardóttir ins enska, kona Ámunda Þorgeirssonar, ",Þóra Bjarnardóttir ins enska,,,,,,,,
5564,"Þóra Eiríksdóttir konungs, kona Gorms hersis í Svíþjóð, ",Þóra Eiríksdóttir konungs,,,,,,,,
5565,"Þóra Gísladóttir,Eyjólfssonar, kona Brands Þórhaddssonar, ",Þóra Gísladóttir,,,,,,,,
5566,"Þóra Guðmundardóttir gríss in eldri, kona Jóns Sigmundarsonar, ",Þóra Guðmundardóttir gríss in eldri,,,,,,,,
5567,"Þóra Guðmundardóttir gríss in yngri, síðari kona Þorvalds Gizurarsonar, ",Þóra Guðmundardóttir gríss in yngri,,,,,,,,
5568,"Þóra Gunnsteinsdóttir, kona Óláfs jafnakolls, ",Þóra Gunnsteinsdóttir,,,,,,,,
5569,"Þóra Hallketilsdóttir, kona Hauks, ",Þóra Hallketilsdóttir,,,,,,,,
5570,"Þóra Hallsteinsdóttir, kona Helga Þorbjarnarsonar ór Arskógi, ",Þóra Hallsteinsdóttir,,,,,,,,
5571,"Þóra Haraldsdóttir gullskeggs, fyrri kona Hálfdanar svarta Guðröðarsonar, ",Þóra Haraldsdóttir gullskeggs,,,,,,,,
5572,"Þóra Helgadóttir ins magra, kona Gunnars Úlfljótssonar í Djúpadal, ",Þóra Helgadóttir ins magra,,,,,,,,
5573,"Þóra Herröðardóttir, drottning Ragnars loðbrókar, ",Þóra Herröðardóttir,,,,,,,,
5574,"Þóra Hörða-Káradóttir, móðir Ulfljóts lögsögumanns, ",Þóra Hörða-Káradóttir,,,,,,,,
5575,"Þóra Hróaldsdóttir hlaðhönd, kona Bjarnar hölds, ",Þóra Hróaldsdóttir hlaðhönd,822,Thora Hroaldsdottir of the Embroidered Hand,:135,Thora of the Embroidered Hand,:0,:-1,:-1,:Egil
5576,"Þóra Hrólfsdóttir rauðskeggs, kona Þorsteins Ingólfssonar í Reykjavík, ",Þóra Hrólfsdóttir rauðskeggs,,,,,,,,
5577,"Þóra Magnúsdóttir konungs, kona Lofts prests Sæmundarsonar, ",Þóra Magnúsdóttir konungs,,,,,,,,
5578,"Þóra Mjallardóttir, kona Úlfs af Hálogalandi, ",Þóra Mjallardóttir,,,,,,,,
5579,"Þóra mosháls Auðunardóttir skókills, kona Halls, ",Þóra mosháls Auðunardóttir skókills,,,,,,,,
5580,"Þóra Nesja-Knjúksdóttir, kona Þorvalds hvíta Þórðarsonar, ",Þóra Nesja-Knjúksdóttir,,,,,,,,
5581,"Þóra Óláfsdóttir feilans, kona Þorsteins þorskabíts, ",Þóra Óláfsdóttir feilans,823,Thora Olafsdottir (Feilan),:410:102:258,Thora,:0:0:2,:7:5:-1,:282:505:-1,:Laxdoela:Gisla:Eyrbyggja
5582,"Þóra Ölvisdóttir, kona Hásteins Atlasonar jarls ins mjóva, ",Þóra Ölvisdóttir,,,,,,,,
5583,"Þóra Rauðsdóttir, á Stokkum í Súrnadal, ",Þóra Rauðsdóttir,824,Thora Raudsdottir (mother of Gisli Sursson),:11,Thora Raudsdottir,:0,:2,:501,:Gisla
5584,"Þóra Sigurðardóttir orms-í-auga, kona Helga Óláfssonar, ",Þóra Sigurðardóttir orms-í-auga,,,,,,,,
5585,"Þóra Snorradóttír goða, kona Kerru-Bersa, síðar Þorgríms sviða, ",Þóra Snorradóttír goða,,,,,,,,
5586,"Þóra Steinsdóttir, Brandasonar, kona Sumarliða, svo Skafta lögsögumanns Þóroddssonar, ",Þóra Steinsdóttir,,,,,,,,
5587,"Þóra Vestarsdóttir, kona Þorgils Geirsteinssonar, ",Þóra Vestarsdóttir,,,,,,,,
5588,"Þóra Þorbergsdóttir, drottning Haralds konungs harðráða, ",Þóra Þorbergsdóttir,,,,,,,,
5589,"Þóra Þorgerðardóttir, kona Þórkels Ásgeirssonar, móðir Ögmundar, ",Þóra Þorgerðardóttir,,,,,,,,
5590,"Þóra Þorgrímsdóttir, í Bólstaðarhlíð, ",Þóra Þorgrímsdóttir,,,,,,,,
5591,"Þóra Þórisdóttir hersis, kona Eiríks alspaks, ",Þóra Þórisdóttir hersis,826,Thora Thorisdottir (sister of Arinbjorn),:220,Thora Thorisdottir,:0,:-1,:-1,:Egil
5592,"Þóra Þorsteinsdóttir holmunns eldra, kona Brands (Branda) Eyvindarsonar, ",Þóra Þorsteinsdóttir holmunns eldra,,,,,,,,
5593,"Þóra Þorsteinsdóttir ins hvíta, ",Þóra Þorsteinsdóttir ins hvíta,,,,,,,,
5594,"Þóra Þorsteinsdóttir, kona Þormóðar Kleppjárnssonar, ",Þóra Þorsteinsdóttir,827,Thora Thorsteinsdottir (Egilsson),:300,Thora Thorsteinsdottir,:0,:-1,:-1,:Egil
5595,"Þóra, at Þórutóftum, kona Ásmundar Atlasonar (Langaholts-Þóra), ",Þóra,,,,,,,,
5596,"Þóra, kona Böðvars, ",Þóra,,,,,,,,
5597,"Þóra, kona Brettings á Brettingsstöðum, ",Þóra,,,,,,,,
5598,"Þórálfr Skeljungsson (Þórólfr), ",Þórálfr Skeljungsson (Þórólfr),,,,,,,,
5599,"Þórálfr Skólmsson inn sterki, at Myrká, ",Þórálfr Skólmsson inn sterki,,,,,,,,
5600,"Þórálfr, á Eyri í Ísafirði, ",Þórálfr,,,,,,,,
5601,"Þórálfr, á Lónseyri, ",Þórálfr,,,,,,,,
5602,"Þórálfr, liðsmaðr Höskulds, ",Þórálfr,,,,,,,,
5603,"Þórálfr, undir Hlöðufelli, ",Þórálfr,,,,,,,,
5604,"Þórarinn (talinn) Þjóðreksson, goðorðsmaðr um Dýrafjörð, ",Þórarinn (talinn) Þjóðreksson,,,,,,,,
5605,"Þórarinn Álfsson inn rammi, í Þambárdal, ",Þórarinn Álfsson inn rammi,,,,,,,,
5606,"Þórarinn Arnljótsson, frá Miðfelli, ",Þórarinn Arnljótsson,,,,,,,,
5607,"Þórarinn Ásbjarnarson, í Seyðisfirði, ",Þórarinn Ásbjarnarson,,,,,,,,
5608,"Þórarinn Atlason ins ramma, ",Þórarinn Atlason ins ramma,,,,,,,,
5609,"Þórarinn Bárðarson, Höskuldssonar, ",Þórarinn Bárðarson,829,Thorarin (husband of Osk Thorsteinsdottir),:488,Thorarin,:1,:25,:318,:Laxdoela
5610,"Þórarinn Benteinsson ofláti, ",Þórarinn Benteinsson ofláti,,,,,,,,
5611,"Þórarinn Böðmóðsson, Þórissonar haustmyrkrs, ",Þórarinn Böðmóðsson,,,,,,,,
5612,"Þórarinn Brandsson, ",Þórarinn Brandsson,831,Thorarin Brandsson,:676,Thorarin Brandsson,:0,:78,:420,:Laxdoela
5613,"Þórarinn Dagsson, Þorkelssonar, ",Þórarinn Dagsson,,,,,,,,
5614,"Þórarinn Egilsson, Eyvindarsonar, ",Þórarinn Egilsson,,,,,,,,
5615,"Þórarinn Egilsson, frá Egilsstöðum, ",Þórarinn Egilsson,,,,,,,,
5616,"Þórarinn Finnason, í Finnafirði, ",Þórarinn Finnason,,,,,,,,
5617,"Þórarinn gjallandi, ",Þórarinn gjallandi,,,,,,,,
5618,"Þórarinn Glúmsson, ",Þórarinn Glúmsson,,,,,,,,
5619,"Þórarinn goði Þorgilsson gjallanda, at Svínavatns, ",Þórarinn goði Þorgilsson gjallanda,,,,,,,,
5620,"Þórarinn Grímkelsson komi (Komi), ",Þórarinn Grímkelsson komi (Komi),,,,,,,,
5621,"Þórarinn Há-Snorrason tosti (eða rosti), ",Þórarinn Há-Snorrason tosti (eða rosti),,,,,,,,
5622,"Þórarinn Hafrsson, ór Goðdölum, ",Þórarinn Hafrsson,,,,,,,,
5623,"Þórarinn Hallkelsson, á Hallkelsstöðum, ",Þórarinn Hallkelsson,,,,,,,,
5624,"Þórarinn Hallsteinsson goða, ",Þórarinn Hallsteinsson goða,,,,,,,,
5625,"Þórarinn Hauksson, ",Þórarinn Hauksson,,,,,,,,
5626,"Þórarinn Helgason ákafi, ",Þórarinn Helgason ákafi,,,,,,,,
5627,"Þórarinn Höskuldsson, á Brettingsstöðum, ",Þórarinn Höskuldsson,,,,,,,,
5628,"Þórarinn illi, ",Þórarinn illi,,,,,,,,
5629,"Þórarinn Ingjaldsson (Þórisson sælings), í Sælingsdalstungu, ",Þórarinn Ingjaldsson (Þórisson sælings),432,Hild Thorarinsdottir,:544,Thorarin,:1,:32,:327,:Laxdoela
5630,"Þórarinn Kolsson, at Kolgröfum, ",Þórarinn Kolsson,,,,,,,,
5631,"Þórarinn krókr, landnm. í Króksfirði, ",Þórarinn krókr,,,,,,,,
5632,"Þórarinn Langdælagoði (rangt: Óspaksson Laxdælagoði) inn spaki, ",Þórarinn Langdælagoði (rangt: Óspaksson Laxdælagoði) inn spaki,,,,,,,,
5633,"Þórarinn lof tunga (Lof tunga), skáld, ",Þórarinn lof tunga (Lof tunga),,,,,,,,
5634,"Þórarinn Loftsson ins gamla, ",Þórarinn Loftsson ins gamla,,,,,,,,
5635,"Þórarinn molduxi, at Hofi, ",Þórarinn molduxi,,,,,,,,
5636,"Þórarinn Nefjólfsson, farmaðr, ",Þórarinn Nefjólfsson,,,,,,,,
5637,"Þórarinn Óleifsson hjalta Ragabróðir, lögsögumaðr, á Varmalæk, ",Þórarinn Óleifsson hjalta Ragabróðir,834,Thorarin Oleifsson Ragi's Brother,:123:427,Thorarin Oleifsson Ragi's Brother,:1:1,:-1:7,:-1:282,:Egil:Laxdoela
5638,"Þórarinn Ölvisson, í Höfða, ",Þórarinn Ölvisson,,,,,,,,
5639,"Þórarinn Önundarson, at Mosfelli, ",Þórarinn Önundarson,,,,,,,,
5640,"Þórarinn Óspaksson Laxdælagoði inn spaki, ",Þórarinn Óspaksson Laxdælagoði inn spaki,,,,,,,,
5641,"Þórarinn Özurarson, ",Þórarinn Özurarson,,,,,,,,
5642,"Þórarinn Skeggjason, skáld, bróðir Markúss lögsögumanns, (faðir Skafta prests ok Þorgeirs, föður Ámunda ok Æsu í Odda), ",Þórarinn Skeggjason,,,,,,,,
5643,"Þórarinn Smiðkelsson, á Þorvarðsstöðum, ",Þórarinn Smiðkelsson,,,,,,,,
5644,"Þórarinn Steinólfsson illi, ",Þórarinn Steinólfsson illi,836,Thorarin the Evil,:147,Thorarin the Evil,:1,:47,:267,:Vatnsdal
5645,"Þórarinn stuttfeldr, skáld, ",Þórarinn stuttfeldr,,,,,,,,
5646,"Þórarinn Þorbjarnarson, Özursonar, ",Þórarinn Þorbjarnarson,,,,,,,,
5647,"Þórarinn Þórðarson fylsenni, í Hvammi, ",Þórarinn Þórðarson fylsenni,837,Thorarin Thordarson Foal's-brow,:408,Thorarin Foal's-brow,:1,:7,:282,:Laxdoela
5648,"Þórarinn Þórðarson ofsi (Þórvaldsson), á Stokkahlöðum, ",Þórarinn Þórðarson ofsi (Þórvaldsson),,,,,,,,
5649,"Þórarinn Þorgeirsson, ór Hítardal, ",Þórarinn Þorgeirsson,,,,,,,,
5650,"Þórarinn Þorgilsson knappa, á Ökrum, ",Þórarinn Þorgilsson knappa,,,,,,,,
5651,"Þórarinn Þorgilsson ok Þóreyjar Gestsdóttur spaka, ",Þórarinn Þorgilsson ok Þóreyjar Gestsdóttur spaka,,,,,,,,
5652,"Þórarinn Þorgilsson, at Búrfelli, ",Þórarinn Þorgilsson,,,,,,,,
5653,"Þórarinn Þorgilsson, spaki, ",Þórarinn Þorgilsson,,,,,,,,
5654,"Þórarinn Þórisson sælingr, ",Þórarinn Þórisson sælingr,,,,,,,,
5655,"Þórarinn Þórisson sælings, ",Þórarinn Þórisson sælings,,,,,,,,
5656,"Þórarinn Þórisson, á Espihóli, ",Þórarinn Þórisson,,,,,,,,
5657,"Þórarinn Þorkelsson ór Alviðru, landnm. í Flóa, ",Þórarinn Þorkelsson ór Alviðru,,,,,,,,
5658,"Þórarinn Þorkelsson skotakolls, ",Þórarinn Þorkelsson skotakolls,,,,,,,,
5659,"Þórarinn Þorkelsson, í Hraunsdal, ",Þórarinn Þorkelsson,,,,,,,,
5660,"Þórarinn Þórólfsson inn svarti Máhlíðingr, skáld, ",Þórarinn Þórólfsson inn svarti Máhlíðingr,,,,,,,,
5661,"Þórarinn Þorsteinsson surts, ",Þórarinn Þorsteinsson surts,,,,,,,,
5662,"Þórarinn Þorvaldsson (rangt Þorgilsson) goði inn spaki, á Lækjamóti í Víðidal, fóstri Víga-Barða, ",Þórarinn Þorvaldsson (rangt Þorgilsson) goði inn spaki,,,,,,,,
5663,"Þórarinn Þorvaldsson ofsi, ",Þórarinn Þorvaldsson ofsi,,,,,,,,
5664,"Þórarinn Þorvarðsson blindi, ",Þórarinn Þorvarðsson blindi,,,,,,,,
5665,"Þórarinn Þverhlíðingr, ",Þórarinn Þverhlíðingr,,,,,,,,
5666,"Þórarinn, á Hellu á Arskógsströnd, ",Þórarinn,828,Thorarin (from the fjord of Oslo),:57,Thorarin,:1,:7,:507,:Gisla
5667,"Þórarinn, bóndi at Klifum við Blönduós (misminni: Halldórr á Kleifum), ",Þórarinn,,,,,,,,
5668,"Þórarinn, bóndi í Grænlands, ",Þórarinn,,,,,,,,
5669,"Þórarinn, bóndi í Sunnudal, ",Þórarinn,,,,,,,,
5670,"Þórarinn, bryti Þorgils örrabeinsstjúps, ",Þórarinn,,,,,,,,
5671,"Þórarinn, fóstrsonr Ljóts ins spaka, ",Þórarinn,,,,,,,,
5672,"Þórarinn, fylgdarmaðr Þorgils ok Jósteins, ",Þórarinn,,,,,,,,
5673,"Þórarinn, goði á Víðimýri, ",Þórarinn,,,,,,,,
5674,"Þórarinn, goðorðsmaðr í Langadal á Skógarströnd, ",Þórarinn,830,Thorarin Bardarson (son of Bard Hoskuldsson),:650,Thorarin,:1,:66,:399,:Laxdoela
5675,"Þórarinn, húskarl Gríms í Grímstungu, ",Þórarinn,,,,,,,,
5676,"Þórarinn, maðr Illuga Tagldarbana, ",Þórarinn,,,,,,,,
5677,"Þórarinn, mágr Þorsteins surts, ",Þórarinn,832,Thorarin in Langadal,:451,Thorarin,:1,:10,:285,:Laxdoela
5678,"Þórarinn, víkverskr stýrimaðr, ",Þórarinn,,,,,,,,
5679,"Þórarinn, þrænzkr stýrimaðr, ",Þórarinn,,,,,,,,
5680,"Þórarna Ásgeirsdóttir, kona Sumarliða Hrappssonar, ",Þórarna Ásgeirsdóttir,,,,,,,,
5681,"Þórarna Eyjólfsdóttir, ",Þórarna Eyjólfsdóttir,,,,,,,,
5682,"Þórarna Gunnólfsdóttir ins gamla (rangt Eyjólfsdóttir), kona Eyvindar Kálfssonar, ",Þórarna Gunnólfsdóttir ins gamla (rangt Eyjólfsdóttir),,,,,,,,
5683,"Þórarna Helgadóttir, kona Loðins Hallasonar, ",Þórarna Helgadóttir,,,,,,,,
5684,"Þórarna Ingólfsdóttir ins sterka, kona Þorsteins Oddleifssonar, ",Þórarna Ingólfsdóttir ins sterka,,,,,,,,
5685,"Þórarna Kedlsdóttir ilbreiðs, kona Herglis hnapprass Þrándarsonar, ",Þórarna Kedlsdóttir ilbreiðs,,,,,,,,
5686,"Þórarna Sigmundardóttir, kona Arnþjófs, ",Þórarna Sigmundardóttir,,,,,,,,
5687,"Þórarna Skeggjadóttir, Þórhallssonar, ",Þórarna Skeggjadóttir,,,,,,,,
5688,"Þórarna Þorkelsdóttir, kona Stórólfs Hængssonar, ",Þórarna Þorkelsdóttir,,,,,,,,
5689,"Þórarna Þóroddsdóttir hjálms, kona Bárðar Þórðarsonar, ",Þórarna Þóroddsdóttir hjálms,,,,,,,,
5690,"Þórarna Þorsteinsdóttir svarfaðar, ",Þórarna Þorsteinsdóttir svarfaðar,,,,,,,,
5691,"Þórarna Þrándardóttir mjóbeins, kona Hrólfs Helgasonar, ",Þórarna Þrándardóttir mjóbeins,,,,,,,,
5692,"Þórarna, grannkona Skalla-Gríms, ",Þórarna,841,Thorarna (sorceress),:99,Thorarna,:0,:-1,:-1,:Egil
5693,"Þórarr víðförli, ",Þórarr víðförli,,,,,,,,
5694,"Þórarr, lögmaðr á Jamtalands, ",Þórarr,,,,,,,,
5695,"Þorbeinir, á Þorbeinisstöðum, ",Þorbeinir,,,,,,,,
5696,"Þórbergr Arnason, höfðingi í Gizka, ",Þórbergr Arnason,,,,,,,,
5697,"Þórbergr höggvinkinni, at Arnarvatni, ",Þórbergr höggvinkinni,,,,,,,,
5698,"Þórbergr Hrútsson, Herjólfssonar, ",Þórbergr Hrútsson,,,,,,,,
5699,"Þórbergr Óláfsson pá, ",Þórbergr Óláfsson pá,843,Thorberg Olafsson (Peacock),:261,Thorberg Olafsson,:1,:-1,:-1,:Egil
5700,"Þórbergr ór íafirði, landnm. í Langadal, ",Þórbergr ór íafirði,,,,,,,,
5701,"Þórbergr Þórarinsson spaka, á Lækjamóti, ",Þórbergr Þórarinsson spaka,,,,,,,,
5702,"Þórbergr Þorkelsson kornamúli, í Ási, ",Þórbergr Þorkelsson kornamúli,,,,,,,,
5703,"Þórbergr Þorvaldsson holbarka, ",Þórbergr Þorvaldsson holbarka,,,,,,,,
5704,"Þorbjörg Ármóðsdóttir, kona Hrúts Herjólfssonar, ",Þorbjörg Ármóðsdóttir,844,Thorbjorg Armodsdottir (second wife of Hrut Herjolfsson),:471,Thorbjorg Armodsdottir,:0,:19,:303,:Laxdoela
5705,"Þorbjörg bekkjarbót Ásgeirsdóttir ins eldra frá Ásgeirsá, kona Knattar Þjóðrekssonar, ",Þorbjörg bekkjarbót Ásgeirsdóttir ins eldra frá Ásgeirsá,845,Thorbjorg Asgeirsdottir Pride of the Farm,:94,Thorbjorg Asgeirsdottir Pride of the Farm,:0,:29,:237,:Vatnsdal
5706,"Þorbjörg Einarsdóttir, kona Hólmkels á Fossi, ",Þorbjörg Einarsdóttir,,,,,,,,
5707,"Þorbjörg Eyvindardóttir, kona Þormóðs ór Laxárdal, ",Þorbjörg Eyvindardóttir,,,,,,,,
5708,"Þorbjörg Glúmsdóttir kolbrún, í Arnardal, ",Þorbjörg Glúmsdóttir kolbrún,,,,,,,,
5709,"Þorbjörg Grímkelsdóttir, kona Indriða Þorvaldssonar, ",Þorbjörg Grímkelsdóttir,,,,,,,,
5710,"Þorbjörg Grímsdóttir ór Hold ok Hallgerðar, kona Lofts Pálssonar byskups, ",Þorbjörg Grímsdóttir ór Hold ok Hallgerðar,,,,,,,,
5711,"Þorbjörg Hákonardóttur kona Gunnbjarnar Brynjólfssonar, svo Hallgríms Brynjólfssonar, ",Þorbjörg Hákonardóttur kona Gunnbjarnar Brynjólfssonar,,,,,,,,
5712,"Þorbjörg Hallvarðsdóttir, ",Þorbjörg Hallvarðsdóttir,,,,,,,,
5713,"Þorbjörg Helgadóttir katla, kona Þorsteins Sölmundarsonar, ",Þorbjörg Helgadóttir katla,,,,,,,,
5714,"Þorbjörg hólmasól Helgadóttir ins magra, kona Böðólfs Grímssonar, ",Þorbjörg hólmasól Helgadóttir ins magra,,,,,,,,
5715,"Þorbjörg Hreinsdótdr, frilla Gizurar Hallssonar, ",Þorbjörg Hreinsdótdr,,,,,,,,
5716,"Þorbjörg Hrólfsdóttir, kona Atla ins rauða Úlfssonar, ",Þorbjörg Hrólfsdóttir,,,,,,,,
5717,"Þorbjörg in digra Óláfsdóttír pá, kona Ásgeirs Knattarsonar í Vatnsfirði, svo Vermundar ins mjóva Þorgrímssonar, ",Þorbjörg in digra Óláfsdóttír pá,847,Thorbjorg Olafsdottir (Peacock),:265:500,Thorbjorg Olaf's daughter,:0:0,:-1:28,:-1:321,:Egil:Laxdoela
5718,"Þorbjörg Ketilsdóttír ins fíflska, kona Vála Loðmundarsonar, ",Þorbjörg Ketilsdóttír ins fíflska,,,,,,,,
5719,"Þorbjörg knarrarbringa Gilsdóttir skeiðarnefs, kona Jörundar Úlfssonar, svo Þorbjarnar Skjalda-Bjarnarsonar, ",Þorbjörg knarrarbringa Gilsdóttir skeiðarnefs,,,,,,,,
5720,"Þorbjörg lítil völva, spákona á Grænlandi, ",Þorbjörg lítil völva,,,,,,,,
5721,"Þorbjörg Önundardóttir, kona Hallgils Þorbrandssonar í Rauðaskriðu, ",Þorbjörg Önundardóttir,,,,,,,,
5722,"Þorbjörg Skeggjadóttir ór Miðfirði (Þorgerðr), kona Ásbjarnar auðga Harðarsonar, ",Þorbjörg Skeggjadóttir ór Miðfirði (Þorgerðr),848,Thorbjorg Skeggjadottir (of Midfjord; see also Thorgerd Skeggjadottir),:378,Thorbjorg,:0,:6,:280,:Laxdoela
5723,"Þorbjörg Skíðadóttir, kona Þorgríms á Borg, ",Þorbjörg Skíðadóttir,849,Thorbjorg Skidadottir,:98,Thorbjorg Skidadottir,:0,:32,:239,:Vatnsdal
5724,"Þorbjörg stöng (Þórdís Þórisdóttir þurs), í Stangarholti, ",Þorbjörg stöng (Þórdís Þórisdóttir þurs),901,Thordis Thorisdottir Stick,:118,Thordis Thorisdottir Stick,:1,:-1,:-1,:Egil
5725,"Þorbjörg Svertingsdóttir, kona (ekki móðir) Sveinbjarnar Hrafnkelssonar goða, ",Þorbjörg Svertingsdóttir,,,,,,,,
5726,"Þorbjörg Þorfinnsdóttir frá Rauðamel, kona Þorbrands Þorfinnssonar í Álftafirði, ",Þorbjörg Þorfinnsdóttir frá Rauðamel,,,,,,,,
5727,"Þorbjörg Þorsteinsdóttir hreggnasa, kona Víga-Styrs Þorgrímssonar, ",Þorbjörg Þorsteinsdóttir hreggnasa,,,,,,,,
5728,"Þorbjörg Þorsteinsdóttir ins hvíta, ",Þorbjörg Þorsteinsdóttir ins hvíta,,,,,,,,
5729,"Þorbjörg, kona Grenjaðar á Melum, ",Þorbjörg,,,,,,,,
5730,"Þorbjörg, kona Högna í Hagavík, ",Þorbjörg,,,,,,,,
5731,"Þorbjörg, vinkona Bjarnar Hítdælakappa, ",Þorbjörg,,,,,,,,
5732,"Þorbjörn á Skálmarnesi, ",Þorbjörn á Skálmarnesi,,,,,,,,
5733,"Þorbjörn Ævarsson strúgr, á Strúgsstöðum, ",Þorbjörn Ævarsson strúgr,,,,,,,,
5734,"Þorbjörn Ármóðsson ins rauða, ",Þorbjörn Ármóðsson ins rauða,,,,,,,,
5735,"Þorbjörn Arnbjarnarson, landnm. í Arnarholti, ",Þorbjörn Arnbjarnarson,,,,,,,,
5736,"Þorbjörn Arngrímsson (Þorsteinsson), á Framnesi, ",Þorbjörn Arngrímsson (Þorsteinsson),,,,,,,,
5737,"Þorbjörn Arnórsson öxnamegin, ",Þorbjörn Arnórsson öxnamegin,,,,,,,,
5738,"Þorbjörn Arnþjófsson inn digri, í Krýsuvík, ",Þorbjörn Arnþjófsson inn digri,,,,,,,,
5739,"Þorbjörn aumingi, arfsalsmaðr Þórðar hreðu, ",Þorbjörn aumingi,,,,,,,,
5740,"Þorbjörn Ávaldason, hellismaðr, ",Þorbjörn Ávaldason,,,,,,,,
5741,"Þorbjörn bitra, landnm. í Birni, ",Þorbjörn bitra,,,,,,,,
5742,"Þorbjörn blesi, landnm. á Blesastöðum í Norðrárdal, ",Þorbjörn blesi,,,,,,,,
5743,"Þorbjörn Böðmóðsson loki, landnm. í Djúpafirði, ",Þorbjörn Böðmóðsson loki,,,,,,,,
5744,"Þorbjörn Böðvarsson skúma, landnm., ",Þorbjörn Böðvarsson skúma,,,,,,,,
5745,"Þorbjörn Böðvarsson spörr, ",Þorbjörn Böðvarsson spörr,,,,,,,,
5746,"Þorbjörn Böðvarsson tálkni, landnm. í Tálknafirði, ",Þorbjörn Böðvarsson tálkni,,,,,,,,
5747,"Þorbjörn Brúnason, at Steinum (Veggjum; Þórólfr, at Sleggjulæk), ",Þorbjörn Brúnason,,,,,,,,
5748,"Þorbjörn búi, ",Þorbjörn búi,,,,,,,,
5749,"Þorbjörn Einarsson, Ketilssonar, ",Þorbjörn Einarsson,,,,,,,,
5750,"Þorbjörn Eiríksson, ",Þorbjörn Eiríksson,,,,,,,,
5751,"Þorbjörn Eysteinsson loki, ",Þorbjörn Eysteinsson loki,,,,,,,,
5752,"Þorbjörn Eyvindarson vápna, ",Þorbjörn Eyvindarson vápna,,,,,,,,
5753,"Þorbjörn ferðalangr, ",Þorbjörn ferðalangr,,,,,,,,
5754,"Þorbjörn Geirmundarson, í Skógum, ",Þorbjörn Geirmundarson,,,,,,,,
5755,"Þorbjörn glaumr (Glaumr), ",Þorbjörn glaumr (Glaumr),,,,,,,,
5756,"Þorbjörn Gnúpa-Bárðarson krumr, ",Þorbjörn Gnúpa-Bárðarson krumr,,,,,,,,
5757,"Þorbjörn Graut-Atlason, ",Þorbjörn Graut-Atlason,,,,,,,,
5758,"Þorbjörn Grenjaðarson, í Tungu, ",Þorbjörn Grenjaðarson,,,,,,,,
5759,"Þorbjörn Grjótgarðsson, víkverskr maðr, ",Þorbjörn Grjótgarðsson,,,,,,,,
5760,"Þorbjörn hornklofi, skáld, ",Þorbjörn hornklofi,854,Thorbjorn Raven (poet),:47,Thorbjorn Raven,:1,:-1,:-1,:Egil
5761,"Þorbjörn Hraðason, at Mosfelli, ",Þorbjörn Hraðason,,,,,,,,
5762,"Þorbjörn Hrómundarson þyna, skáld, at Fagrabrekku, ",Þorbjörn Hrómundarson þyna,,,,,,,,
5763,"Þorbjörn inn óargi, ",Þorbjörn inn óargi,,,,,,,,
5764,"Þorbjörn inn sterki, sendimaðr Gests í Haga, ",Þorbjörn inn sterki,,,,,,,,
5765,"Þorbjörn inn svarti, grænlenzkr maðr, ",Þorbjörn inn svarti,,,,,,,,
5766,"Þorbjörn inn svarti, landnm. at Skeljabrekku, ",Þorbjörn inn svarti,,,,,,,,
5767,"Þorbjörn Ísröðarson, á Veggjum, ",Þorbjörn Ísröðarson,,,,,,,,
5768,"Þorbjörn jarlakappi, landnm. at Hólum í Hrunamannahreppi, ",Þorbjörn jarlakappi,,,,,,,,
5769,"Þorbjörn Karlsefnisson, ",Þorbjörn Karlsefnisson,,,,,,,,
5770,"Þorbjörn kjálki, í Kjálkafirði, ",Þorbjörn kjálki,,,,,,,,
5771,"Þorbjörn Kjallaksson skröfuðr, á Ketilsstöðum, ",Þorbjörn Kjallaksson skröfuðr,,,,,,,,
5772,"Þorbjörn kolka, landnm. at Kolkumýrum, ",Þorbjörn kolka,,,,,,,,
5773,"Þorbjörn kórekr, á Kóreksstöðum, ",Þorbjörn kórekr,,,,,,,,
5774,"Þorbjörn krumr, ",Þorbjörn krumr,,,,,,,,
5775,"Þorbjörn laxakarl, landnm. í Haga í Þjósárdal, ",Þorbjörn laxakarl,,,,,,,,
